id,question,answer,answerable,category,relevant_ids,source
2436,"There are 55 people at the track meet. 30 of them are boys, and the rest are girls. Three fifths of the girls have long hair, and the rest have short hair. How many girls have short hair?",[10.0],True,,,GSM8K
1541,"Alberto spent $2457 on a new engine for his car. Samara spent $25 on oil, $467 on tires and $79 on detailing for her car. How many more dollars did Alberto spend on his car?",[1886.0],True,,,GSM8K
86,Baker made 81 cakes. Then he made 92 more cakes. He sold 46 of them..How many more cakes did baker make than those he sold?,[127.0],True,,,SVAMP
1666,John buys 2 packs of index cards for all his students.  He has 6 classes and 30 students in each class.  How many packs did he buy?,[360.0],True,,,GSM8K
739, A pet store had 56 puppies. In one day they sold 24 of them and put the rest into cages with 4 in each cage. How many cages did they use? ,[8.0],True,,,MultiArith
2061,"Xavier runs three times as many miles as Katie, who runs 4 times as many miles as Cole. If Xavier runs 84 miles, how many miles does Cole run?",[7.0],True,,,GSM8K
1971,"Bill's roof can bear 500 pounds of weight. If 100 leaves fall on his roof every day, and 1000 leaves weighs 1 pound, how many days will it take for his roof to collapse?",[5000.0],True,,,GSM8K
1587,"Sally is selling boxes of crackers for her scout troop's fund-raiser. If she sells 50% more on Sunday than she sold on Saturday, then she'll have sold a total of 150 boxes on the two days. How many boxes did she sell on Saturday?",[60.0],True,,,GSM8K
1247,"Jolene and Phil have four children, each with the same birthday.  They gave birth to their first child exactly 15 years ago.  They gave birth to their second child exactly one year after the birth of their first child.  They gave birth to their third child on the fourth birthday of their second child. Two years after the birth of their third child, they gave birth to their fourth child.  How old, in years, is their fourth child?",[8.0],True,,,GSM8K
2149,Marcos has to get across a 5 mile lake in his speedboat in 10 minutes so he can make it to work on time. How fast does he need to go in miles per hour to make it?,[30.0],True,,,GSM8K
2335,Ruth is counting the number of spots on her cow. The cow has 16 spots on its left side and three times that number plus 7 on its right side. How many spots does it have total?,[71.0],True,,,GSM8K
1777,"Jeremy listened to five fewer songs yesterday than today. Yesterday, he listened to nine songs. How many songs did Jeremy listen to in two days?",[23.0],True,,,GSM8K
389,Julia played tag with a total of 18 kids. She played with 4 kids on monday and yet with some more kids on tuesday..How many kids did she play with on tuesday?,[14.0],True,,,SVAMP
584," Tom was putting his spare change into piles. He had 2 piles of quarters and 4 piles of dimes. If each pile had 5 coins in it, how many coins did he have total? ",[30.0],True,,,MultiArith
2429,"Isabelle gets a job so she can save enough money to go to a concert with her two brothers. Her ticket costs $20. Her brothers both get the children’s discount, and each of their tickets cost $10. Her brothers have saved $5 between the two of them and Isabelle has saved $5. If her job pays $3 per week, how many weeks must she work to afford the tickets?",[10.0],True,,,GSM8K
1102,"Ever since she was a little girl, Sheila has dreamed of traveling the world. To help fund her dream, she bought a large piggy bank in December and started saving. By last week, she had saved $3,000. Pleased with her progress, she has decided to continue saving $276 per month, for 4 years. Today, Sheila’s family secretly added $7,000 into the piggy bank. At the end of 4 years, how much money will be in Sheila’s piggy bank?",[23248.0],True,,,GSM8K
1490,"A laboratory needs flasks, test tubes, and safety gear to carry out its experiments. They were given a $325 budget for the month. They bought $150 worth of flasks, spent two-thirds of that amount on test tubes, and used half of the test tube cost on safety gear. How many dollars of their budget remained?",[25.0],True,,,GSM8K
337,At the stop 13 more people got on the bus. Initially there were 4 people on the bus..How many people are there on the bus now?,[17.0],True,,,SVAMP
1909,"Penelope the pig eats 20 pounds of food per day, which is 10 times more than Greta the goose eats per day.  Milton the mouse eats 1/100 as much as Greta the goose eats per day, but Elmer the elephant eats 4000 times more than Milton the mouse does per day.  How much more, in pounds, does Elmer the elephant eat per day than Penelope the pig?",[60.0],True,,,GSM8K
759," Isabel baked 39 cupcakes for her school's bake sale. If her brother, Todd, ate 21 of them how many packages could she make if she put 3 cupcake in each package? ",[6.0],True,,,MultiArith
617," Nancy was organizing her book case making sure each of the shelves had exactly 6 books on it. If she had 2 shelves of mystery books and 6 shelves of picture books, how many books did she have total? ",[48.0],True,,,MultiArith
1323,"In spring, a family planted trees to capture the sun. They planted 3 times as many peaches as apricots. If 58 apricot trees were planted, how many trees were planted in total?",[232.0],True,,,GSM8K
792," Olivia and her mom were picking carrots from their garden. Olivia picked 20 and her mother picked 14. If only 19 of the carrots were good, how many bad carrots did they have? ",[15.0],True,,,MultiArith
5035,58 children are taking a bus to the zoo. They sit 2 children in every seat..How many seats will the children need in all?,[29.0],True,,,ASDiv
160,3 birds were sitting on the fence. 6 more storks and 2 more birds came to join them..How many more storks than birds are sitting on the fence?,[1.0],True,,,SVAMP
5097,Jerry owned seven video games. For his birthday he got two more..How many games did Jerry have total?,[9.0],True,,,ASDiv
2291,"Mark is filling a punch bowl that can hold 16 gallons of punch. He fills it part way, then his cousin comes along and drinks half the punch in the bowl. Mark starts to refill the bowl and adds 4 more gallons, but then his friend Sally comes in and drinks 2 more gallons of punch. After that, Mark has to add 12 gallons of punch to completely fill the bowl. How much punch did Mark initially add to the bowl?",[4.0],True,,,GSM8K
1269,"Carson is sorting seaweed for various uses. 50% of the seaweed is only good for starting fires. 25% of what's left can be eaten by humans, and the rest is fed to livestock. If Carson harvests 400 pounds of seaweed, how many pounds are fed to livestock?",[150.0],True,,,GSM8K
2261,A store sold a certain brand of jeans for $40. They only have few pairs of jeans left so they decided to give 10% discount on every two pairs of jeans bought by a customer at any one time. How much will a customer pay for 3 pairs of jeans?,[112.0],True,,,GSM8K
1761,"Coral is reading a book that is 600 pages long.  She reads half of it in the first week, and 30 percent of the remaining pages the second week. How many pages must she read the third week in order to finish the book?",[210.0],True,,,GSM8K
2108,"The bagels cost $2.25 each, or a dozen for $24. How much is saved, per bagel, in cents, by buying a dozen at a time?",[25.0],True,,,GSM8K
950,"Ivar owns a stable. He recently has 3 horses and each horse consumes 5 liters of water for drinking and 2 liters for bathing per day. If he added 5 horses, how many liters of water does Ivar need for all the horses for 28 days?",[1568.0],True,,,GSM8K
2301,"To make a cherry pie, Veronica needs 3 pounds of pitted cherries.  There are 80 single cherries in one pound of cherries.   It takes 10 minutes to pit 20 cherries.  How many hours will it take Veronica to pit all the cherries?",[2.0],True,,,GSM8K
1793,"Beth had 150 students in her 10th-grade class.  The following year 30 more students join.  In her final year, 15 students left.  How many students did Beth have in her class at the end of her final year?",[165.0],True,,,GSM8K
1401,A family bought 1 box of pizza that is cut into 16 slices. Only three-fourths of the pizza was eaten by the family. How many slices of pizza were left?,[4.0],True,,,GSM8K
53,Baker made 133 cakes. If he sold 51 of them.How many more cakes did baker make than those he sold?,[82.0],True,,,SVAMP
604," At the schools book fair Victor bought 32 adventure books and 37 mystery books. If 16 of the books were used, how many new books did he buy? ",[53.0],True,,,MultiArith
547," Sam was collecting cans for recycling. On Saturday he filled 4 bags up and on Sunday he filled 3 more bags. If each bag had 6 cans in it, how many cans did he pick up total? ",[42.0],True,,,MultiArith
542," Nancy and her mom were picking carrots from their garden. Nancy picked 38 and her mother picked 47. If only 71 of the carrots were good, how many bad carrots did they have? ",[14.0],True,,,MultiArith
285,Dave had 10 apps on his phone. He added 11 new apps. After deleting some he had 4 left..How many apps did he delete?,[17.0],True,,,SVAMP
723," Isabel had 72 homework problems. She finished 32 of them but still had 5 pages of problems to do. If each page has the same number of problems on it, how many problems are on each page? ",[8.0],True,,,MultiArith
1667,"Emmalyn decided to paint fences in her neighborhood for twenty cents per meter. If there were 50 fences in the neighborhood that she had to paint and each fence was 500 meters long, calculate the total amount she earned from painting the fences.",[5000.0],True,,,GSM8K
834,"A group of 300 athletes spent Saturday night at Ultimate Fitness Camp. The next morning, for 4 hours straight, they left the camp at a rate of 28 athletes per hour. Over the next 7 hours, a new group of athletes trickled into the camp at a rate of 15 athletes per hour. Immediately thereafter, the camp gate was shut and everyone went to bed. What is the difference in the total number of athletes in the camp over the two nights?",[7.0],True,,,GSM8K
1848,Matthew asked his children how many hotdogs they wanted for dinner.  Both Ella and Emma agreed they wanted 2 hotdogs each.  Luke said he could eat twice the amount of hotdogs as his sisters while Hunter said he could only eat 1 and half times the total amount of his sisters.  How many hotdogs did Matthew need to cook?,[14.0],True,,,GSM8K
115,Jake has 3 fewer peaches than Steven who has 8 more peaches than Jill. Steven has 5 peaches..How many more peaches does Jake have than Jill?,[5.0],True,,,SVAMP
1105,"Bill is hoarding toilet paper in fear of another pandemic. Bill goes to the bathroom three times a day and uses 5 squares of toilet paper each time. If Bill has 1000 rolls of toilet paper and each roll has 300 squares of toilet paper, how many days will his toilet paper supply last?",[20000.0],True,,,GSM8K
251,If Lewis earns a total of $ 460 during 5 weeks of harvest.How much money does he earn each week?,[92.0],True,,,SVAMP
1591,Six kids and two adults are going to the circus. Kid's tickets are on sale for only half of the adult tickets. The total cost is $50. How much is one kid's ticket?,[5.0],True,,,GSM8K
1010,"Preston has a sandwich shop. He charges $5 for each sandwich. He also charges $20 for a delivery fee. Abra Company orders 18 sandwiches from Preston and also tips him 10%. How much total, in dollars, did Preston receive?",[121.0],True,,,GSM8K
1993,"John works at 2 different hospitals.  At the first hospital, he sees 20 different patients each day.  At the second hospital, he sees 20% more individual patients a day.  He works 5 days a week.  How many patients does he treat a year if he works 50 weeks a year?",[11000.0],True,,,GSM8K
519," Ned bought 14 boxes of chocolate candy and gave 7 to his little brother. If each box has 6 pieces inside it, how many pieces did Ned still have? ",[42.0],True,,,MultiArith
932,One serving of soup has 1 cup of vegetables and 2.5 cups of broth. How many pints of vegetables and broth combined would be needed for 8 servings?,[14.0],True,,,GSM8K
5084,"Mark has 13 trees in his backyard. If he plants 12 more,.how many trees will he have?",[25.0],True,,,ASDiv
1177,"A fan can create an airflow of 10 liters per second. If the fan works for 10 minutes each day, calculate the amount of airflow it will create in one week.",[42000.0],True,,,GSM8K
936,"There are three buckets full of oranges. There are 22 oranges in the first bucket, 17 more oranges in the second bucket and 11 fewer oranges in the third bucket than in the second. How many oranges are there in all the buckets?",[89.0],True,,,GSM8K
1468,"Julio goes fishing and can catch 7 fish every hour. By the 9th hour, how many fish does Julio have if he loses 15 fish in the process?",[48.0],True,,,GSM8K
1807,"A school principal is booking hotel rooms for a class of 30 students to stay at during an overnight field trip.  Each of the hotel's rooms has two queen size beds, which can fit two students each, and a pull-out couch, which can fit one student.  How many rooms does the principal need to book to fit all of the students in the class?",[6.0],True,,,GSM8K
54,Frank was reading through his favorite book. The book had 392 pages and he read 14 pages per day..How many days did he take to finish the book?,[28.0],True,,,SVAMP
1800,"A carnival snack booth made $50 selling popcorn each day. It made three times as much selling cotton candy. For a 5-day activity, the booth has to pay $30 rent and $75 for the cost of the ingredients. How much did the booth earn for 5 days after paying the rent and the cost of ingredients?",[895.0],True,,,GSM8K
722," The school cafeteria ordered 33 red apples and 23 green apples for students lunches. But, if only 21 students wanted fruit, how many extra did the cafeteria end up with? ",[35.0],True,,,MultiArith
1027,"Jonas is trying to expand his wardrobe.  He has 20 pairs of socks, 5 pairs of shoes, 10 pairs of pants and 10 shirts.  How many pairs of socks does he need to buy to double the number of individual items in his wardrobe?",[35.0],True,,,GSM8K
5016,"A pet store had six kittens. If they got another three kittens,.how many would they have total?",[9.0],True,,,ASDiv
35,Jerry had some action figures on a shelf in his room. Later he added 7 more action figures to the shelf. If there are a total of 10 action figures on his shelf now.How many action figures did he have initially on the shelf?,[3.0],True,,,SVAMP
362,Danny collects bottle caps and wrappers. He found 58 bottle caps and 25 wrappers at the park. Now he has 11 wrappers and 12 bottle caps in his collection..How many more bottle caps than wrappers does Danny have now?,[1.0],True,,,SVAMP
718," A trivia team had 15 members total, but during a game 6 members didn't show up. If each member that did show up scored 3 points, how many points were scored total? ",[27.0],True,,,MultiArith
243,In a school there are 308 girls and 318 boys. There are also 36 teachers.How many pupils are there in that school?,[626.0],True,,,SVAMP
1696,"Jerry works as an independent contractor for a company that pays him $40 per task. If each task takes him two hours to complete and he works 10 hours a day for a whole week, calculate the total amount of money he would earn at the end of the week.",[1400.0],True,,,GSM8K
1327,Kaiden is collecting cans of soup for the local soup kitchen. He collects 158 cans during his first week and 259 during the second week. If his goal is to collect 500 cans how many more cans of soup does he need to collect?,[83.0],True,,,GSM8K
1087,"Of 96 oranges, half were ripe. If 1/4 of the ripe oranges were eaten and 1/8 of the unripe oranges were eaten, how many were left eaten in total?",[78.0],True,,,GSM8K
1944,Gretchen's local ice cream shop offers 100 different flavors.  She was able to try a 1/4 of the flavors 2 years ago and double that amount last year.  How many more flavors will she need to try this year to have tried all 100 flavors?,[25.0],True,,,GSM8K
693," There school's baseball team had 12 new players and 44 returning players. If the coach put them into groups with 8 players in each group, how many groups would there be? ",[7.0],True,,,MultiArith
852,"The lights in Malcolm’s house are flickering, and he hopes that replacing all of his white lights with colored lights will make it stop. He buys 12 red lights, 3 times as many blue lights, and 6 green lights.  If he still has 5 colored lights left to buy, how many white lights did Malcolm have initially?",[59.0],True,,,GSM8K
5040,The school is planning a field trip. The school has 11 classrooms. There are 100 students in the school and 20 seats on each school bus..How many buses are needed to take the trip?,[5.0],True,,,ASDiv
361,Tom ate 36 cookies. If he had 37 cookies initially.How many cookies did Tom have left?,[1.0],True,,,SVAMP
122,Mary is baking a cake. The recipe calls for 12 cups of flour 5 cups of sugar and 49 cups of salt. She already put in 11 cups of flour..How many more cups of flour does she need to add?,[1.0],True,,,SVAMP
573," Paige had 43 math problems and 12 science problems for homework. If she finished 44 of the problems at school, how many problems did she have to do for homework? ",[11.0],True,,,MultiArith
1165,"A car is driving through a tunnel with many turns. After a while, the car must travel through a ring that requires a total of 4 right-hand turns. After the 1st turn, it travels 5 meters. After the 2nd turn, it travels 8 meters. After the 3rd turn, it travels a little further and at the 4th turn, it immediately exits the tunnel. If the car has driven a total of 23 meters around the ring, how far did it have to travel after the 3rd turn?",[10.0],True,,,GSM8K
1383,"Suzanne wants to raise money for charity by running a 5-kilometer race. Her parents have pledged to donate $10 for her first kilometer and double the donation for every successive kilometer. If Suzanne finishes the race, how much money will her parents donate?",[310.0],True,,,GSM8K
338,There are 18 bananas in Philip's banana collection. If the bananas are organized into groups of size 2.How many groups are there?,[9.0],True,,,SVAMP
1923,"Omi is twice as old as Kimiko. Arlette is 3/4 times as old as Kimiko. If Kimiko is 28 years old, calculate the average age of the three?",[35.0],True,,,GSM8K
1211,"At football tryouts, the coach wanted to see who could throw the ball the farthest.  Parker threw the ball 16 yards.  Grant threw the ball 25 percent farther than Parker and Kyle threw the ball 2 times farther than Grant.  Compared to Parker, how much farther did Kyle throw the ball?",[24.0],True,,,GSM8K
1495,"Enrico owns a rooster farm, he sells each rooster for $0.50 per kilogram. He was able to sell a 30-kilogram rooster and a 40-kilogram rooster, how much money was he able to earn?",[35.0],True,,,GSM8K
1808,Vincent’s washer broke so he had to go to the laundromat. On Wednesday he washed six loads of clothes. The next day he had time to wash double the number of loads he did the day before. On Friday he had a test and could only manage half of the loads he did on Thursday. On Saturday the laundromat closed at noon and he could only wash a third of the loads of laundry he did on Wednesday. How many loads of laundry had he washed that week?,[26.0],True,,,GSM8K
76,Paul got a box of 457 erasers and 617 crayons for his birthday. At the end of the school year he only had 523 crayons left while not having lost a single eraser..How many more crayons than erasers did he have left?,[66.0],True,,,SVAMP
1723,Mark has an egg farm. His farm supplies one store with 5 dozen eggs and another store with 30 eggs each day. How many eggs does he supply these two stores in a week?,[630.0],True,,,GSM8K
1951,"Henley bought 300 candies and shared them with her two brothers. However, they realized 40% of them were sour, and they had to separate those out. If they then shared the good candies equally, how many candies did each get?",[60.0],True,,,GSM8K
2136,Ralph is a member of the cross-country relay team. There are four other members on the team who run 3 km to complete their part of the race. Ralph runs twice as much as any member on his team to complete his part of the race. How long is the race?,[18.0],True,,,GSM8K
2364,"This morning, farmer Rita's workers collected 30,000 gallons of milk and chilled it in a storage tank. They then spent the next 4 hours pumping milk at a rate of 2,880 gallons/hour from the storage tank into a milk tanker. For the next 7 hours, the workers added more milk into the storage tank, at a rate of 1,500 gallons per hour. How many gallons of milk were left in the storage tank?",[28.0],True,,,GSM8K
2130,"Allison, a YouTuber, uploads 10 one-hour videos of food reviews each day to her channel. She uploaded videos halfway through June,  at that pace,  and then doubled the number of video hours she uploaded on the remaining days. What's the total number of video hours she has uploaded at the end of the month?",[450.0],True,,,GSM8K
2390,"Sarah interviewed 450 students at her school and asked them which fruit they liked best - oranges, apples, pears or strawberries. 70 students said they liked oranges, 120 students said they liked pears, and 147 students said they liked apples. How many students picked strawberries as their favorite fruit from the list?",[113.0],True,,,GSM8K
1396,"Mark had 10 pieces of fruit to eat in school this week. On Friday, he decided to keep 2 pieces of fruit for next week. He then brings the remaining 3 pieces of fruit to school for the day. How many pieces of fruit did Mark eat in the first four days of the week?",[5.0],True,,,GSM8K
1470,"Caroline has 40 pairs of socks. She loses 4 pairs of socks at the laundromat. Of the remaining pairs of socks, she donates two-thirds to the thrift store. Then she purchases 10 new pairs of socks, and she receives 3 new pairs of socks as a gift from her dad. How many pairs of socks does Caroline have in total?",[25.0],True,,,GSM8K
1420,"Jessie invited 4 friends over to play. They made muffins for a snack and Jesse wants to divide them equally between herself and her friends. If they made 20 muffins in total, how many will each person have?",[4.0],True,,,GSM8K
1832,Lizzy had $30. She loaned out $15 to her friend. How much will Lizzy have if her friend returned the money with an interest of 20%?,[33.0],True,,,GSM8K
2287,"Sarah's age is equal to three times Mark's age minus 4. Mark is four years older than Billy. Billy is half Ana's age. If Ana will be 15 in 3 years, how old is Sarah?",[26.0],True,,,GSM8K
2139,James takes 5 oranges and breaks each orange into 8 pieces.  He splits the pieces between 4 people.  If an orange has 80 calories how many calories does each person get?,[100.0],True,,,GSM8K
569," A waiter had 9 tables he was waiting on, with 4 women and 3 men at each table. How many customers total did the waiter have? ",[63.0],True,,,MultiArith
1300,"Ali is collecting bottle caps. He has 125 bottle caps. He has red ones and green ones. If he has 50 red caps, what percentage of caps are green?",[60.0],True,,,GSM8K
1479,"The mayor commissioned two artists to paint 50 murals around the city. Once the work was completed, Celina was paid $1,000 more than 4 times the amount Diego got. If the mayor paid the two a total of $50,000, how much did Diego get?",[9800.0],True,,,GSM8K
583," A worksheet had 4 problems on it. If a teacher had 9 worksheets to grade and had already graded 5 of them, how many more problems does she have to grade? ",[16.0],True,,,MultiArith
1850,"She sold twice as many boxes on Tuesday as she did on Wednesday, and she sold twice as many boxes on Wednesday as she did on Thursday. If Kim sold 1200 boxes of cupcakes on Thursday, how many boxes did she sell on Tuesday?",[4800.0],True,,,GSM8K
418,A book has 2 chapters. The first chapter is 60 pages long. If there are a total of 93 pages in the book.How many pages are in the second chapter?,[33.0],True,,,SVAMP
1562,"Kyle bikes for 2 hours to work every day. Ten times the time he takes to travel to work and back is the same as the cost of buying a pack of snacks (in dollars). How much will Ryan pay, in dollars, to buy 50 packs of snacks?",[2000.0],True,,,GSM8K
1266,"In the first team, Beth scored 12 while Jan scored 10. In the second team, Judy scored 8 while Angel scored 11. How many more points did the first team get than the second team?",[3.0],True,,,GSM8K
2318,"If 1 ounce of Dawn liquid soap can make 200,000 bubbles, and Dr. Bronner's liquid soap can make twice as many bubbles per ounce as Dawn liquid soap, then how many bubbles can be made from one half ounce of an equal mixture of Dawn and Dr. Bronner's liquid soaps?",[150.0],True,,,GSM8K
1307,Caleb bought 10 cartons of ice cream and 4 cartons of frozen yogurt. Each carton of ice cream cost $4 and each carton of frozen yogurt cost $1. How much more did Caleb spend on ice cream than on frozen yogurt?,[36.0],True,,,GSM8K
2069,"Mike is shopping at the mall. He needs to buy a shirt, a new wallet, and some food for the evening. The shirt costs a third of the value of the wallet. The wallet is $60 more than the cost of the food, on which Mike spent $30. How much did Mike spend that day on the shopping?",[150.0],True,,,GSM8K
804,Every morning Harry takes 15 minutes to buy coffee and a bagel and twice that long to read the paper and eat before going in to work. How long does Harry's morning routine take?,[45.0],True,,,GSM8K
500,Luke gained 146 points in each round of a game. If he played 157 rounds of a trivia game.How many points did he score in the game?,[22922.0],True,,,SVAMP
1357,There are 9 bicycles and 16 cars in the garage. How many wheels are there in the garage?,[82.0],True,,,GSM8K
