Question,Answer
Who acted as Maynard in the movie 'Wrong Turn 5: Bloodlines'?,Doug Bradley
Who acted as Dr. Ivan Ivanovich Ivanov in the movie 'Man with the Screaming Brain'?,Stacy Keach
Who acted as DeCarlo in the movie 'Omen III: The Final Conflict'?,Rossano Brazzi
Who acted as Mary Aarons in the movie 'Bridge to Terabithia'?,Kate Butler
Who acted as Howard Hughes in the movie 'Melvin and Howard'?,Jason Robards
Who acted as Echeverria in the movie 'Altered States'?,Thaao Penghlis
Who acted as Chase Matthews in the movie 'Pet Sematary II'?,Anthony Edwards
Who acted as Nathan Huffner in the movie 'Parenthood'?,Rick Moranis
Who acted as Hobie in the movie 'Melinda and Melinda'?,Will Ferrell
Who acted as Simon Grady in the movie 'Cube²: Hypercube'?,Geraint Wyn Davies
Who acted as Lauren in the movie 'The Two Faces of January'?,Daisy Bevan
Who acted as Toby in the movie 'Alvin and the Chipmunks: The Squeakquel'?,Zachary Levi
Who acted as Montana Moorehead in the movie 'Soapdish'?,Cathy Moriarty
Who acted as Sheila in the movie 'Motherhood'?,Minnie Driver
Who acted as Abigail Salmon in the movie 'The Lovely Bones'?,Rachel Weisz
Who acted as Inui Sei-jiroh in the movie 'Paprika'?,Toru Emori
Who acted as Prisoner K in the movie 'Ghost Machine'?,Halla Vilhjálmsdóttir
Who acted as Ethan in the movie 'I Am Legend'?,Charlie Tahan
Who acted as Detective Duffy in the movie 'The Boondock Saints'?,Brian Mahoney
Who acted as Sybil Gordon in the movie 'Chariots of Fire'?,Alice Krige
Who acted as Connie Martin in the movie 'Follow the Fleet'?,Harriet Hilliard
Who acted as Don Pedro Aragón in the movie 'A Walk in the Clouds'?,Anthony Quinn
Who acted as Troy in the movie 'Thirteen Conversations About One Thing'?,Matthew McConaughey
Who acted as Tiger Lily in the movie 'Pan'?,Rooney Mara
Who acted as Judy Webb in the movie 'The Sweetest Thing'?,Parker Posey
Who acted as Josh in the movie 'Bait'?,Xavier Samuel
Who acted as X in the movie 'Last Year at Marienbad'?,Giorgio Albertazzi
Who acted as Maya in the movie 'Kama Sutra - A Tale of Love'?,Indira Varma
Who acted as Katina in the movie 'Three Steps Above Heaven'?,Marina Salas
Who acted as Mario Mario in the movie 'Super Mario Bros.'?,Bob Hoskins
Who acted as Millie Warne in the movie 'Miss Potter'?,Emily Watson
Who acted as Harry in the movie 'Revenge for Jolly!'?,Brian Petsos
Who acted as Margo Channing in the movie 'All About Eve'?,Bette Davis
Who acted as Lily Kawamura/McGann in the movie 'Come See the Paradise'?,Tamlyn Tomita
Who acted as Clyde in the movie 'Mean Creek'?,Ryan Kelley
Who acted as Locke in the movie 'Sleeping with the Enemy'?,Tony Abatemarco
Who acted as Raúl Castro in the movie 'Che: Part Two'?,Rodrigo Santoro
Who acted as Lehrer in the movie 'The White Ribbon'?,Christian Friedel
"Who acted as Orin Scrivello, DDS in the movie 'Little Shop of Horrors'?",Steve Martin
Who acted as Tom Smith in the movie 'Seabiscuit'?,Chris Cooper
Who acted as Chun-Li in the movie 'Street Fighter II: The Animated Movie'?,Miki Fujitani
Who acted as Mary in the movie 'About Time'?,Rachel McAdams
Who acted as Sra. Verónica in the movie 'Sleep Tight'?,Petra Martínez
Who acted as Tomas in the movie 'While She Was Out'?,Luis Chávez
Who acted as Jason Sherwood in the movie 'The English Teacher'?,Michael Angarano
Who acted as Amy in the movie 'Would You Rather'?,Sasha Grey
Who acted as Trip Murphy in the movie 'Herbie Fully Loaded'?,Matt Dillon
Who acted as Judy Sheperd in the movie 'Jumanji'?,Kirsten Dunst
Who acted as Myassa in the movie 'Transsiberian'?,Thomas Kretschmann
Who acted as Christopher White in the movie 'Caprice'?,Richard Harris
Who acted as Allegra in the movie 'The Jane Austen Book Club'?,Maggie Grace
Who acted as Moe Shrevnitz in the movie 'The Shadow'?,Peter Boyle
Who acted as Daphne in the movie 'Scooby-Doo! The Mystery Begins'?,Kate Melton
Who acted as Radley in the movie 'Thrashin''?,Josh Richman
Who acted as Mitch McDeere in the movie 'The Firm'?,Tom Cruise
Who acted as Matt Tomley in the movie 'Chestnut: Hero of Central Park'?,Louis Ferreira
Who acted as Otis in the movie 'Because of Winn-Dixie'?,Dave Matthews
Who acted as Cliff in the movie 'Blast from the Past'?,Nathan Fillion
Who acted as Lt. Frank Bullit in the movie 'Bullitt'?,Steve McQueen
Who acted as Burt Weinberg in the movie 'The Wedding Planner'?,Lou Myers
Who acted as Old Hermit Jacob in the movie 'The Woman in Black 2: Angel of Death'?,Ned Dennehy
Who acted as Kat in the movie 'GirlHouse'?,Alice Hunter
Who acted as Moira in the movie 'Cheeky'?,Francesca Nunzi
Who acted as Scott McCoy in the movie 'Leprechaun 3'?,John Gatins
Who acted as Billy York in the movie 'National Lampoon's Loaded Weapon 1'?,Whoopi Goldberg
Who acted as Troy in the movie 'Shrooms'?,Max Kasch
Who acted as Gus Klein in the movie 'Shattered'?,Bob Hoskins
Who acted as The Cat in the movie 'The Cat in the Hat'?,Mike Myers
Who acted as Mitzi Huggins in the movie 'The Campaign'?,Sarah Baker
Who acted as Sam in the movie 'Moonrise Kingdom'?,Jared Gilman
Who acted as Andre Delambre in the movie 'The Fly'?,David Hedison
Who acted as Shepard in the movie 'The Fly II'?,Frank C. Turner
Who acted as Eve in the movie 'God Help the Girl'?,Emily Browning
Who acted as April in the movie 'Winter's Bone'?,Sheryl Lee
Who acted as Eddie in the movie 'Mr. & Mrs. Smith'?,Vince Vaughn
Who acted as Max California in the movie '8MM'?,Joaquin Phoenix
Who acted as Hogan in the movie 'Little Birds'?,Neal McDonough
Who acted as Rooster in the movie 'Righteous Kill'?,Al Pacino
Who acted as Flora bambina in the movie 'The Mafia Kills Only in Summer'?,Ginevra Antona
Who acted as Bill Sullivan in the movie 'The Good Shepherd'?,Robert De Niro
Who acted as Himself in the movie 'Full Tilt Boogie'?,Harvey Keitel
Who acted as Chaoz in the movie 'No Tears for the Dead'?,Brian Tee
Who acted as Natalie in the movie 'Evil Dead'?,Elizabeth Blackmore
Who acted as Jackie Cogan in the movie 'Killing Them Softly'?,Brad Pitt
Who acted as Gordon in the movie 'See Spot Run'?,David Arquette
Who acted as Rio in the movie 'One-Eyed Jacks'?,Marlon Brando
Who acted as Himself in the movie 'American Grindhouse'?,John Landis
Who acted as Irina in the movie 'Aftershock'?,Natasha Yarovenko
Who acted as David Filby in the movie 'The Time Machine'?,Mark Addy
Who acted as Pris in the movie 'Blade Runner'?,Daryl Hannah
Who acted as Chong in the movie 'Nice Dreams'?,Tommy Chong
Who acted as Le Seigneur Arnold in the movie 'Dragon Hunters'?,Philippe Nahon
Who acted as Shadow in the movie 'Homeward Bound II: Lost in San Francisco'?,Ralph Waite
Who acted as Gillian Bellaver in the movie 'The Fury'?,Amy Irving
Who acted as Aunt Eller in the movie 'Oklahoma!'?,Charlotte Greenwood
Who acted as Clay in the movie 'Personal Effects'?,Spencer Hudson
Who acted as Jean in the movie 'Priceless'?,Gad Elmaleh
Who acted as Rydal Keener in the movie 'The Two Faces of January'?,Oscar Isaac
Who acted as Edie Cohen in the movie 'The Women'?,Debra Messing
Who acted as Varek in the movie 'Skinwalkers'?,Jason Behr
Who acted as Коля in the movie 'Afonya'?,Evgeni Leonov
Who acted as The First Lady in the movie 'First Daughter'?,Margaret Colin
Who acted as Dr. Stan Powell in the movie 'What Lies Beneath'?,Ray Baker
Who acted as Harling Mays in the movie 'Flight'?,John Goodman
Who acted as Aldo in the movie 'Battle for the Planet of the Apes'?,Claude Akins
Who acted as Jake Fischer in the movie 'The Guardian'?,Ashton Kutcher
Who acted as Nicola Carati in the movie 'The Best of Youth'?,Luigi Lo Cascio
Who acted as Anna Reed in the movie 'Good People'?,Kate Hudson
Who acted as Джоконда in the movie '9th Company'?,Konstantin Kryukov
Who acted as Gorsky in the movie 'Babylon A.D.'?,Gérard Depardieu
Who acted as Irma Bunt in the movie 'On Her Majesty's Secret Service'?,Ilse Steppat
Who acted as Beverly Aadland in the movie 'The Last of Robin Hood'?,Dakota Fanning
Who acted as Dara in the movie 'Kissing a Fool'?,Kari Wuhrer
Who acted as Fabrice in the movie 'The Beat That My Heart Skipped'?,Jonathan Zaccaï
Who acted as O.W. Grant in the movie 'Interstate 60'?,Gary Oldman
Who acted as Caterer in the movie 'Don't Be Afraid of the Dark'?,Emelia Burns
Who acted as Paul in the movie 'Breathless'?,William Tepper
Who acted as Pete Randle in the movie 'The Gingerbread Man'?,Tom Berenger
Who acted as Tito in the movie 'Living in Oblivion'?,Peter Dinklage
Who acted as Jochen Maiwald in the movie '23'?,Stephan Kampwirth
Who acted as Pat in the movie 'Goon'?,Jay Baruchel
Who acted as Mary Florescu in the movie 'Book of Blood'?,Sophie Ward
Who acted as Jimmy the avid editor in the movie 'Rosewater'?,Andrew Gower
Who acted as Dolan 37th in the movie 'The Last Witch Hunter'?,Elijah Wood
Who acted as Tony Francis in the movie 'The Adventures of Pluto Nash'?,Jay Mohr
Who acted as Sandy in the movie 'Underworld U.S.A.'?,Beatrice Kay
Who acted as Colonel Hamilton in the movie 'The Raven'?,Brendan Gleeson
Who acted as Daisy in the movie 'Charlotte Gray'?,Abigail Cruttenden
Who acted as Remy Royce-Graff in the movie 'Earthquake'?,Ava Gardner
Who acted as Kevin Caffery in the movie 'What's the Worst That Could Happen?'?,Martin Lawrence
Who acted as Giles in the movie 'The Last House on the Left'?,Joshua Cox
Who acted as Gang Leader in the movie 'The Heroine'?,Jackie Chan
Who acted as Dean Carl Cain in the movie 'How High'?,Obba Babatundé
Who acted as Devlin Adams in the movie 'Just Go with It'?,Nicole Kidman
Who acted as Jack Burroughs in the movie 'The Four Seasons'?,Alan Alda
Who acted as Rex in the movie 'Sex Drive'?,James Marsden
Who acted as Robert in the movie 'Freezer'?,Dylan McDermott
"Who acted as Carol Ann in the movie 'To Wong Foo, Thanks for Everything! Julie Newmar'?",Stockard Channing
Who acted as Grandma Bunny in the movie 'You Again'?,Betty White
Who acted as Bert in the movie 'Man Up'?,Ken Stott
Who acted as Thomas in the movie 'Dance Flick'?,Damon Wayans Jr.
Who acted as Tars Tarkas in the movie 'John Carter'?,Willem Dafoe
Who acted as Sweeny in the movie 'Premature Burial'?,John Dierkes
Who acted as Martha Guthrie in the movie 'Hawking'?,Alice Eve
Who acted as Rachel in the movie 'I Spy'?,Famke Janssen
Who acted as Chief Insp. Charles LaRousse Dreyfus in the movie 'Curse of the Pink Panther'?,Herbert Lom
Who acted as Sanjay in the movie 'The Guilt Trip'?,Danny Pudi
Who acted as Palmer in the movie 'Dreamer: Inspired By a True Story'?,David Morse
Who acted as Ms. Black in the movie 'Resident Evil'?,Indra Ové
Who acted as Ms. Connors in the movie 'Class of 1999'?,Pam Grier
Who acted as Mimi in the movie 'Kiss of the Damned'?,Roxane Mesquida
Who acted as Jillian in the movie 'Elsewhere'?,Tania Raymonde
Who acted as Robert in the movie 'Lord of the Flies'?,Nicholas Hammond
Who acted as Sophie in the movie 'We Are Your Friends'?,Emily Ratajkowski
Who acted as Linda Partridge in the movie 'Magnolia'?,Julianne Moore
Who acted as Nicole in the movie 'A Lot Like Love'?,Aimee Garcia
Who acted as Frank Whitaker in the movie 'Far from Heaven'?,Dennis Quaid
Who acted as Carol in the movie 'Pineapple Express'?,Rosie Perez
Who acted as Frank in the movie 'No Way Back'?,Michael Lerner
Who acted as Josephine Fabrizio in the movie 'Messenger of Death'?,Marilyn Hassett
Who acted as Sally in the movie 'Critters'?,Lin Shaye
Who acted as  in the movie 'PK'?,Anushka Sharma
Who acted as Mike in the movie 'Homecoming'?,Matt Long
Who acted as Jane Bux in the movie 'The Neverending Story III: Escape from Fantasia'?,Tracey Ellis
Who acted as Brit in the movie 'Spring Breakers'?,Ashley Benson
Who acted as Deputy in the movie 'We're No Angels'?,Bruno Kirby
Who acted as King Miraz in the movie 'The Chronicles of Narnia: Prince Caspian'?,Sergio Castellitto
Who acted as Noah Percy in the movie 'The Village'?,Adrien Brody
Who acted as Jack in the movie 'She's Out of My League'?,Mike Vogel
Who acted as Eddie Cantrow in the movie 'The Heartbreak Kid'?,Ben Stiller
Who acted as Fortis in the movie 'In Time'?,Alex Pettyfer
Who acted as Talia in the movie 'Piranhaconda'?,Rachel Hunter
Who acted as Eden Ross in the movie 'Control'?,Kathleen Robertson
Who acted as Zach in the movie 'Open Water 2: Adrift'?,Niklaus Lange
Who acted as Sonia Bergerac in the movie 'Skirt Day'?,Isabelle Adjani
Who acted as Franny in the movie 'Song One'?,Anne Hathaway
Who acted as Sam in the movie 'Rudderless'?,Billy Crudup
Who acted as  in the movie 'Takeshis''?,Susumu Terajima
Who acted as An American Pilot in the movie 'A Matter of Life and Death'?,Bonar Colleano
Who acted as Rita Baker in the movie 'The Vanishing'?,Nancy Travis
Who acted as Olivia in the movie 'She's the Man'?,Laura Ramsey
Who acted as Laura - Yellow Team in the movie 'Midnight Madness'?,Debra Clinger
Who acted as Britt in the movie 'Another Cinderella Story'?,Emily Perkins
Who acted as Ben in the movie 'Lucky'?,Colin Hanks
Who acted as Seth in the movie 'Race to Witch Mountain'?,Alexander Ludwig
Who acted as Jeff in the movie 'The Houses October Built'?,Jeff Larson
Who acted as Lucy in the movie 'Hours'?,Lena Clark
Who acted as Colonel Dexter Armstrong in the movie 'Off Limits'?,Scott Glenn
Who acted as Johnny in the movie 'Naked'?,David Thewlis
Who acted as Akane Ayukawa in the movie 'Sadako 3D'?,Satomi Ishihara
Who acted as Madame Truska in the movie 'Cirque du Freak: The Vampire's Assistant'?,Salma Hayek
Who acted as Will Shaw in the movie 'The Cold Light of Day'?,Henry Cavill
Who acted as Peter Donahue in the movie 'The Sweetest Thing'?,Thomas Jane
Who acted as Louis in the movie 'Gigli'?,Lenny Venito
Who acted as Emira in the movie 'Welcome to Sarajevo'?,Emira Nušević
Who acted as Simon Silver in the movie 'Red Lights'?,Robert De Niro
Who acted as Sully in the movie 'Nine Dead'?,Chip Bent
Who acted as Carlo Tommasi in the movie 'The Best of Youth'?,Fabrizio Gifuni
Who acted as David Zellaby in the movie 'Village of the Damned'?,Martin Stephens
Who acted as Robyn Starling in the movie 'Tom and Jerry: The Movie'?,Anndi McAfee
Who acted as Ms. Nora Dinsmoor in the movie 'Great Expectations'?,Anne Bancroft
Who acted as Kenny Ortega in the movie 'This Is It'?,Kenny Ortega
Who acted as Virgil Cole in the movie 'Appaloosa'?,Ed Harris
Who acted as Anton in the movie 'Idle Hands'?,Devon Sawa
Who acted as Kyle Reese in the movie 'Terminator Salvation'?,Anton Yelchin
Who acted as Mason Baylor in the movie 'Batteries not Included'?,Dennis Boutsikaris
Who acted as Emily Callaway in the movie 'Hide and Seek'?,Dakota Fanning
Who acted as George Newton in the movie 'Beethoven'?,Charles Grodin
Who acted as Heidi Clements in the movie 'The Cutting Edge: Going for the Gold'?,Kim Kindrick
Who acted as Claudia Larson in the movie 'Home for the Holidays'?,Holly Hunter
Who acted as Andrew in the movie 'Young People Fucking'?,Josh Dean
Who acted as Ludwig Beck in the movie 'Valkyrie'?,Terence Stamp
Who acted as  in the movie 'Jack and the Cuckoo-Clock Heart'?,Grand Corps Malade
Who acted as Benjamin in the movie 'Who Am I'?,Tom Schilling
Who acted as Conner in the movie 'Wolves'?,杰森·莫玛
Who acted as Earl Mott in the movie 'Ruthless People'?,Bill Pullman
Who acted as Jill Trevers in the movie 'The Black Cat'?,Mimsy Farmer
Who acted as Senator Crocker Jarmon in the movie 'The Candidate'?,Don Porter
Who acted as Bernice in the movie 'Bottle Rocket'?,Haley Miller
Who acted as Father in the movie 'Hiroshima Mon Amour'?,Pierre Barbaud
Who acted as Francis Matthias in the movie 'The Lords of Salem'?,Bruce Davison
Who acted as Uncle Rico in the movie 'Napoleon Dynamite'?,Jon Gries
Who acted as Tess Bell in the movie 'Moon'?,Dominique McElligott
Who acted as Davy Gordon in the movie 'Killer's Kiss'?,Jamie Smith
Who acted as Rowley Jefferson in the movie 'Diary of a Wimpy Kid: Rodrick Rules'?,Robert Capron
Who acted as Cpl. Thomas Searles in the movie 'Glory'?,Andre Braugher
Who acted as Lisa Taylor in the movie 'My Boss's Daughter'?,Tara Reid
Who acted as Mabel Tell in the movie 'Restless'?,Jane Adams
Who acted as Barney in the movie 'The Moguls'?,Tim Blake Nelson
Who acted as Julie in the movie 'According to Greta'?,Evan Ross
Who acted as Tom Baker in the movie 'Cheaper by the Dozen 2'?,Steve Martin
Who acted as Herself in the movie 'The Unbelievers'?,Cameron Diaz
"Who acted as Nicola, Nina, Blonde in the movie 'The Singing Detective'?",Robin Wright
Who acted as Monty Capuletti in the movie 'Easy Money'?,Rodney Dangerfield
Who acted as Wendell Hamilton in the movie 'The Hamiltons'?,Joseph McKelheer
Who acted as Frank Goode in the movie 'Everybody's Fine'?,Robert De Niro
Who acted as Monroe Rutherford in the movie 'The Diary of a Teenage Girl'?,Alexander Skarsgård
Who acted as Dolly in the movie 'Must Love Dogs'?,Stockard Channing
Who acted as Arthur Bach in the movie 'Arthur'?,Dudley Moore
Who acted as Priscilla Hall in the movie 'A Christmas Kiss'?,Elisabeth Röhm
Who acted as Ingrid in the movie 'Next Door'?,Anna Bache-Wiig
Who acted as R.J. MacReady in the movie 'The Thing'?,Kurt Russell
Who acted as Jeep Hanson in the movie 'Legion'?,Lucas Black
Who acted as Avery Arable in the movie 'Charlotte's Web'?,Danny Bonaduce
Who acted as Dracula / Dr. Van Helsing in the movie 'Nadja'?,Peter Fonda
Who acted as Tolly Devlin in the movie 'Underworld U.S.A.'?,Cliff Robertson
Who acted as Emma in the movie 'The Time Machine'?,Sienna Guillory
Who acted as Miss Marquez in the movie 'Jack'?,Jennifer Lopez
Who acted as Nova in the movie 'Planet of the Apes'?,Linda Harrison
Who acted as Casey Ryback in the movie 'Under Siege 2: Dark Territory'?,Steven Seagal
Who acted as Dr. Alex Durant in the movie 'The Black Hole'?,Anthony Perkins
Who acted as Napoleon in the movie 'Mirror Mirror'?,Jordan Prentice
Who acted as Sol Roth in the movie 'Soylent Green'?,Edward G. Robinson
Who acted as Louisa Kittredge in the movie 'Six Degrees of Separation'?,Stockard Channing
Who acted as Dargis in the movie 'Garfield: A Tail of Two Kitties'?,Billy Connolly
Who acted as Salvucci in the movie 'All the Right Moves'?,Paul Carafotes
Who acted as Mary Foster in the movie 'Swept from the Sea'?,Zoë Wanamaker
Who acted as Dr. Duffy in the movie 'Futureworld'?,Arthur Hill
Who acted as Humma Kavula in the movie 'The Hitchhiker's Guide to the Galaxy'?,John Malkovich
Who acted as Baby Daddy in the movie 'Dance Flick'?,Shawn Wayans
Who acted as Susan Brookes in the movie 'Molly'?,Jill Hennessy
Who acted as Mark in the movie 'The Protector'?,Petchtai Wongkamlao
Who acted as Marchena in the movie '1492: Conquest of Paradise'?,Fernando Rey
Who acted as Alfred Kralik in the movie 'The Shop Around the Corner'?,James Stewart
Who acted as Linda in the movie 'Open Water'?,Christina Zenato
Who acted as Choi in the movie '21'?,Aaron Yoo
Who acted as Howard in the movie 'Krampus'?,David Koechner
Who acted as Agnis Hamm in the movie 'The Shipping News'?,Judi Dench
Who acted as Bodi Grogan in the movie 'Marley & Me: The Puppy Years'?,Travis Turner
Who acted as Oliver Martin in the movie 'A Lot Like Love'?,Ashton Kutcher
Who acted as Eva in the movie 'Witching & Bitching'?,Carolina Bang
Who acted as Mitsuko Kawai in the movie 'Dark Water'?,Mirei Oguchi
Who acted as Diane in the movie 'Catch Hell'?,Joyful Drake
Who acted as Igor Prokoff in the movie 'Cargo'?,Claude-Oliver Rudolph
Who acted as June Boatwright in the movie 'The Secret Life of Bees'?,Alicia Keys
Who acted as Chow Mo-Wan in the movie '2046'?,Tony Leung Chiu-Wai
Who acted as Cher Horowitz in the movie 'Clueless'?,Alicia Silverstone
Who acted as Brandt Ruger in the movie 'The Hunting Party'?,Gene Hackman
Who acted as Sonja Burpo in the movie 'Heaven is for Real'?,Kelly Reilly
Who acted as Head of a department Byeon in the movie 'No Tears for the Dead'?,Kim Hee-won
Who acted as Arno Penzias in the movie 'Hawking'?,Michael Brandon
Who acted as James Corrigan in the movie 'Europa Report'?,Sharlto Copley
Who acted as Medic Goldshmidt in the movie 'Chernobyl Diaries'?,Alex Feldman
Who acted as Omar in the movie 'Traitor'?,Saïd Taghmaoui
Who acted as Dick in the movie 'Threesome'?,Alexis Arquette
Who acted as Harold Jennings in the movie 'Freaky Friday'?,Dick Van Patten
Who acted as Gas Station Attendant in the movie 'The Hills Have Eyes'?,Tom Bower
"Who acted as Kevin Brown, Agent Kay in the movie 'Men in Black II'?",Tommy Lee Jones
Who acted as Himself in the movie 'Going to Pieces: The Rise and Fall of the Slasher Film'?,John Carpenter
Who acted as Jesse Lujack in the movie 'Breathless'?,Richard Gere
Who acted as  in the movie 'Haider'?,Shraddha Kapoor
Who acted as Rick in the movie 'Third Person'?,James Franco
Who acted as le propriétaire in the movie 'Repulsion'?,Patrick Wymark
Who acted as Burnett in the movie 'Walled In'?,Eugene Clark
Who acted as Mrs. Theresa Piletti in the movie 'Marty'?,Esther Minciotti
Who acted as Pearl in the movie 'Bones'?,Pam Grier
Who acted as Dan Erickson in the movie 'Saw V'?,Mark Rolston
Who acted as Travis Sanders in the movie 'The Game Plan'?,Моррис Честнат
Who acted as Willie Gutierrez in the movie 'The Yards'?,Joaquin Phoenix
Who acted as Moist in the movie 'Dr. Horrible's Sing-Along Blog'?,Simon Helberg
Who acted as Emily in the movie 'The Beyond'?,Cinzia Monreale
Who acted as Weird Wally in the movie 'Below'?,Zach Galifianakis
"Who acted as Jack Harmon in the movie 'If It's Tuesday, This Must Be Belgium'?",Michael Constantine
Who acted as Rocky Merric in the movie 'Mean Creek'?,Trevor Morgan
Who acted as T.J. in the movie 'Gia'?,Eric Michael Cole
Who acted as Town Soldier in the movie 'The Rover'?,Nash Edgerton
Who acted as Jerry Lee in the movie 'The Motel Life'?,Stephen Dorff
Who acted as Lloyd in the movie 'Witchboard'?,James W. Quinn
Who acted as Charles Dexter Ward / Joseph Curwen in the movie 'The Haunted Palace'?,Vincent Price
Who acted as Jon Flint in the movie 'Beverly Hills Cop III'?,Héctor Elizondo
Who acted as Sam in the movie 'The Descent'?,MyAnna Buring
Who acted as Rory Blanes in the movie 'Chasers'?,Matthew Glave
Who acted as Linda in the movie 'Enter the Void'?,Paz de la Huerta
Who acted as Ada McGrath in the movie 'The Piano'?,Holly Hunter
Who acted as Francis Hamilton in the movie 'The Hamiltons'?,Cory Knauf
Who acted as Miss Giddens in the movie 'The Innocents'?,Deborah Kerr
Who acted as Matthew in the movie 'The Trigger Effect'?,Kyle MacLachlan
Who acted as Meeker in the movie 'Halloween 5: The Revenge of Michael Myers'?,Beau Starr
Who acted as Jacqueline in the movie 'Café de Flore'?,Vanessa Paradis
Who acted as Detective Kranz in the movie 'The Human Centipede (First Sequence)'?,Andreas Leupold
Who acted as Roy in the movie 'Transsiberian'?,Woody Harrelson
Who acted as Rice in the movie 'Cloak & Dagger'?,Michael Murphy
"Who acted as Waldo Evans in the movie 'Sorry, Wrong Number'?",Harold Vermilyea
Who acted as Mrs. Pell in the movie 'Mississippi Burning'?,Frances McDormand
Who acted as Marco in the movie 'Any Day Now'?,Isaac Leyva
Who acted as Dr. Rex Martin in the movie 'Brain Dead'?,Bill Pullman
Who acted as Howard Langston in the movie 'Jingle All the Way'?,Arnold Schwarzenegger
Who acted as Ye-sung in the movie 'Miracle in Cell No. 7'?,Park Shin-hye
Who acted as Terri Flores in the movie 'Anaconda'?,Jennifer Lopez
Who acted as Erin in the movie 'Starry Eyes'?,Fabianne Therese
Who acted as Gage in the movie 'Playing God'?,Michael Massee
Who acted as Eva in the movie 'Enough Said'?,Julia Louis-Dreyfus
Who acted as Jeremy Prokosch in the movie 'Contempt'?,Jack Palance
Who acted as Erik Maria Bark in the movie 'The Hypnotist'?,Mikael Persbrandt
Who acted as Mac in the movie 'Local Hero'?,Peter Riegert
Who acted as Tommy Ross in the movie 'Carrie'?,William Katt
Who acted as Jody in the movie 'What Lies Beneath'?,Diana Scarwid
Who acted as Homer Van Meter in the movie 'Dillinger'?,Harry Dean Stanton
Who acted as Milo Tindle in the movie 'Sleuth'?,Michael Caine
Who acted as Dirk Pitt in the movie 'Sahara'?,Matthew McConaughey
Who acted as Susan Pevensie in the movie 'The Chronicles of Narnia: Prince Caspian'?,Anna Popplewell
Who acted as Mina in the movie 'Hansel & Gretel: Witch Hunters'?,Pihla Viitala
Who acted as Janice Evans in the movie 'The Good Son'?,Ashley Crow
Who acted as Bridesmaid in the movie 'A Night at the Roxbury'?,Eva Mendes
Who acted as Carla in the movie 'Thunder and the House of Magic'?,Elisa Gabrielli
Who acted as Odell in the movie 'Below'?,Matthew Davis
Who acted as Dr. Hollander in the movie 'Home Room'?,Holland Taylor
Who acted as Tsuyako Yamashita in the movie 'Departures'?,Kazuko Yoshiyuki
Who acted as Mr. Coker in the movie 'The Day of the Triffids'?,Mervyn Johns
Who acted as Big Enos Burdette in the movie 'Smokey and the Bandit Part 3'?,Pat McCormick
Who acted as Roger Donahue in the movie 'The Sweetest Thing'?,Jason Bateman
Who acted as Juror 1 in the movie '12 Angry Men'?,Martin Balsam
Who acted as Halics in the movie 'Satantango'?,Alfréd Járai
Who acted as Ed Avery in the movie 'Bigger Than Life'?,James Mason
Who acted as Additional voices in the movie 'Pocahontas II: Journey to a New World'?,Finola Hughes
Who acted as Bambas in the movie 'The Bank Job'?,Alki David
Who acted as Tim in the movie 'Cyrus'?,Matt Walsh
Who acted as Himself in the movie 'Bigger Stronger Faster*'?,Sylvester Stallone
Who acted as Kate in the movie 'Dr. T and the Women'?,Farrah Fawcett
Who acted as Lawyer #2 in the movie 'Deception'?,Andrew Ginsburg
Who acted as Laurie Shaw in the movie 'The Cold Light of Day'?,Caroline Goodall
Who acted as Dr. Armstrong in the movie 'Lifeforce'?,Patrick Stewart
Who acted as Solina in the movie 'Dracula 2000'?,Jennifer Esposito
Who acted as Nicky Parzeno in the movie 'Fear City'?,Jack Scalia
Who acted as Caesar in the movie 'Bound'?,Joe Pantoliano
Who acted as Amy Finch in the movie 'An American Werewolf in Paris'?,Julie Bowen
Who acted as Carter Duryea in the movie 'In Good Company'?,Topher Grace
Who acted as David in the movie 'The Canal'?,Rupert Evans
