Question,Answer
Who acted as Jack Burridge in the movie 'Boy A'?,Andrew Garfield
Who acted as Dennis Gilley in the movie 'King of New York'?,David Caruso
Who acted as Chicago in the movie 'Poetic Justice'?,Joe Torry
Who acted as Augusta Jordan in the movie 'Original Sin'?,Allison Mackie
Who acted as Nihal in the movie 'Winter Sleep'?,Melisa Sözen
Who acted as Zeus in the movie 'Clash of the Titans'?,Laurence Olivier
Who acted as Old Weird Harold in the movie 'Fat Albert'?,Aaron Frazier
Who acted as Jorge in the movie 'Son of the Mask'?,Kal Penn
Who acted as Destroyer in the movie 'Doom'?,Deobia Oparei
Who acted as Casper in the movie 'Beneath the Harvest Sky'?,Emory Cohen
Who acted as Skylar in the movie 'The Cell 2'?,Bart Johnson
Who acted as Mr. X in the movie 'Eraserhead'?,Allen Joseph
Who acted as Milly in the movie 'Bellflower'?,Jessie Wiseman
Who acted as Stacie in the movie 'Lottery Ticket'?,Naturi Naughton
Who acted as Melinda Ledbetter in the movie 'Love & Mercy'?,Elizabeth Banks
Who acted as Mrs. Brawne in the movie 'Bright Star'?,Kerry Fox
Who acted as Di Cosimo in the movie 'The Postman'?,Mariano Rigillo
Who acted as Pickett Smith in the movie 'Frogs'?,Sam Elliott
Who acted as Arthur Lestrange in the movie 'The Blue Lagoon'?,William Daniels
Who acted as Eva in the movie 'Goon'?,Alison Pill
Who acted as Elli in the movie 'A Coffee in Berlin'?,Katharina Schüttler
Who acted as Mike Roark in the movie 'Volcano'?,Tommy Lee Jones
Who acted as Tim Wheddon in the movie 'Dear John'?,Henry Thomas
Who acted as Abraham Lincoln in the movie 'Killing Lincoln'?,Billy Campbell
Who acted as Rei Ayanami in the movie 'Evangelion: 3.0 You Can (Not) Redo'?,Megumi Hayashibara
Who acted as Caroline Butler in the movie 'Mr. Mom'?,Teri Garr
Who acted as Klaatu in the movie 'The Day the Earth Stood Still'?,Keanu Reeves
Who acted as Michel Raven in the movie 'Ten Little Indians'?,Charles Aznavour
Who acted as Jerry in the movie 'Liar Liar'?,Cary Elwes
Who acted as Le débauché in the movie 'The Monk'?,Sergi López
Who acted as Yanko in the movie 'Swept from the Sea'?,Vincent Pérez
Who acted as Brian Stevenson in the movie 'Little Monsters'?,Fred Savage
Who acted as Harriet in the movie 'Welcome to the Rileys'?,Ally Sheedy
Who acted as Jerry in the movie 'Tom and Jerry: The Movie'?,Dana Hill
Who acted as Kerrigan in the movie 'Only the Strong'?,Geoffrey Lewis
Who acted as Uncle Henry in the movie 'Tom and Jerry & The Wizard of Oz'?,Stephen Root
Who acted as Elizabeth Parker in the movie 'A Far Off Place'?,Patricia Kalember
Who acted as Brittany Wilson in the movie 'White Chicks'?,Maitland Ward
Who acted as Dr. Hal Raglan in the movie 'The Brood'?,Oliver Reed
Who acted as Mario in the movie 'Emmanuelle'?,Alain Cuny
Who acted as Ambassador Toulon in the movie 'M. Butterfly'?,Ian Richardson
Who acted as Sheriff Hague in the movie 'Planet Terror'?,Michael Biehn
Who acted as Madeleine Beaulieu in the movie 'Love at First Fight'?,Adèle Haenel
Who acted as Julian Rigby in the movie 'The Disappearance of Eleanor Rigby: Her'?,William Hurt
Who acted as Duane Duke in the movie 'Psycho III'?,Jeff Fahey
Who acted as Louise Clancy in the movie 'Naked'?,Lesley Sharp
Who acted as  in the movie 'Come Out and Play'?,Gerardo Taracena
Who acted as Myriam in the movie 'Monsieur Ibrahim'?,Lola Naymark
Who acted as Vaughn Haige in the movie 'My Super Ex-Girlfriend'?,Rainn Wilson
Who acted as Mrs. Paley in the movie 'Cube²: Hypercube'?,Barbara Gordon
Who acted as David Avery in the movie 'Very Good Girls'?,Boyd Holbrook
Who acted as Thelma in the movie 'The Final Cut'?,Mimi Kuzyk
Who acted as Window Washer in the movie 'Unconditional Love'?,Peter Sarsgaard
Who acted as Justice Sumpter in the movie 'The Trials of Cate McCall'?,James Cromwell
Who acted as Renata in the movie 'The Taming of the Scoundrel'?,Milly Carlucci
Who acted as James in the movie 'God Help the Girl'?,Olly Alexander
Who acted as Mr. Chow in the movie 'The Hangover Part II'?,Ken Jeong
Who acted as Mona Stevens in the movie 'Pitfall'?,Lizabeth Scott
Who acted as Arthur Gayle in the movie 'This Boy’s Life'?,Jonah Blechman
Who acted as Edie Stall in the movie 'A History of Violence'?,Maria Bello
Who acted as Lisa Webber in the movie 'A Nightmare on Elm Street Part 2: Freddy's Revenge'?,Kim Myers
Who acted as Rikke in the movie 'The Substitute'?,Emma Juel Justesen
Who acted as MushMouth in the movie 'Fat Albert'?,Jermaine Williams
Who acted as Elton Deedle in the movie 'Meet the Deedles'?,Eric Braeden
Who acted as Betsy / Donna in the movie 'Honeymoon in Vegas'?,Sarah Jessica Parker
Who acted as Hypnotist in the movie 'Possession'?,William B. Davis
Who acted as Darko in the movie 'A Lonely Place to Die'?,Karel Roden
Who acted as Hector in the movie 'The Pool Boys'?,Efren Ramirez
Who acted as Chief Warren Kincaid in the movie 'Bride of Chucky'?,John Ritter
Who acted as Carla in the movie 'Alfie'?,Shirley Anne Field
Who acted as Lai in the movie 'The Transporter'?,Shu Qi
Who acted as Tabitha in the movie 'Scary Movie 3'?,Marny Eng
Who acted as Adrien in the movie 'The Divide'?,Ashton Holmes
Who acted as Debbie in the movie 'About Last Night'?,Joy Bryant
Who acted as Viviane in the movie 'With This Ring'?,Jill Scott
Who acted as Older Daughter in the movie 'Dogtooth'?,Angeliki Papoulia
Who acted as Patient 14 in the movie 'Banshee Chapter'?,Monique Candelaria
Who acted as Tom Gilbert in the movie 'Picture This'?,Kevin Pollak
Who acted as Herzog in the movie 'Dead Snow 2: Red vs. Dead'?,Ørjan Gamst
Who acted as Mother in the movie 'Last Days in the Desert'?,Ayelet Zurer
Who acted as Joyce in the movie 'Private Lessons'?,Pamela Jean Bryant
Who acted as French King in the movie 'Henry V'?,Paul Scofield
Who acted as Richard Straker in the movie 'Salem's Lot'?,Donald Sutherland
Who acted as Lenore in the movie 'Tammy'?,Kathy Bates
Who acted as Lurch / Garvey in the movie 'The Wedding Ringer'?,Jorge Garcia
Who acted as Luvlee in the movie 'The Lookout'?,Isla Fisher
Who acted as Himself in the movie 'Salinger'?,Martin Sheen
Who acted as Himself in the movie 'Paper Heart'?,Seth Rogen
Who acted as Julia in the movie 'Third Person'?,Mila Kunis
Who acted as Queen in the movie 'Three Wishes for Cinderella'?,Karin Lesch
Who acted as Sheriff Annie Flynn in the movie 'Unearthed'?,Emmanuelle Vaugier
Who acted as Taylor Elizabeth Berry in the movie 'Middle of Nowhere'?,Willa Holland
Who acted as Wayne in the movie 'Kristy'?,Mathew St. Patrick
Who acted as Gary in the movie 'The Trigger Effect'?,Michael Rooker
Who acted as Dr. Alex Tremor in the movie 'The Butcher's Wife'?,Jeff Daniels
Who acted as Toni in the movie 'Wrong Turn 6: Last Resort'?,Aqueela Zoll
Who acted as Joe Patroni in the movie 'Airport 1975'?,George Kennedy
Who acted as  in the movie 'Better Living Through Chemistry'?,Ray Liotta
Who acted as Angela Gray in the movie 'Regression'?,Emma Watson
Who acted as Dr. Savran in the movie 'K-19: The Widowmaker'?,Donald Sumpter
Who acted as Pastor in the movie 'Mea Culpa'?,Gilles Cohen
Who acted as Dylan Johns in the movie 'Poseidon'?,Josh Lucas
Who acted as Dr. Woodleigh in the movie 'Dark Corners'?,Toby Stephens
Who acted as Sada in the movie 'In the Realm of the Senses'?,Eiko Matsuda
Who acted as Michael Bergstrom in the movie 'The Net'?,Ken Howard
Who acted as Hiram Gummer in the movie 'Tremors 4: The Legend Begins'?,Michael Gross
Who acted as Joshua Cairn in the movie 'Joshua'?,Jacob Kogan
Who acted as Father Philip Lamont in the movie 'Exorcist II: The Heretic'?,Richard Burton
Who acted as Jenny Garrison in the movie 'Fame'?,Kay Panabaker
Who acted as Kristen in the movie 'Horsemen'?,Zhang Ziyi
Who acted as Kenneth Bradley in the movie 'An Affair to Remember'?,Richard Denning
Who acted as Lamont Cranston/The Shadow in the movie 'The Shadow'?,Alec Baldwin
"Who acted as Ron Wilson, Bus Driver in the movie 'Sky High'?",Kevin Heffernan
Who acted as Scarlett in the movie 'V/H/S: Viral'?,Emmy Argo
Who acted as Sheriff Garris in the movie 'Friday the 13th Part VI: Jason Lives'?,David Kagen
Who acted as Ken Mattingly in the movie 'Apollo 13'?,Gary Sinise
Who acted as Bob Amory in the movie 'One-Eyed Jacks'?,Ben Johnson
Who acted as Randy in the movie 'Beneath'?,Joey Kern
Who acted as Paul Avery in the movie 'Zodiac'?,Robert Downey Jr.
Who acted as Darquandier in the movie 'Babylon A.D.'?,Lambert Wilson
Who acted as Gary in the movie 'L.I.E.'?,Billy Kay
Who acted as Simon Wyler in the movie 'The Lake House'?,Christopher Plummer
Who acted as Hawkeye/Nathaniel Poe in the movie 'The Last of the Mohicans'?,Daniel Day-Lewis
Who acted as Carlos in the movie 'Paranormal Activity: The Marked Ones'?,Eddie J. Fernandez
Who acted as Edgar Weeden / Ezra Weeden in the movie 'The Haunted Palace'?,Leo Gordon
Who acted as Vera Cruz in the movie 'The Skin I Live In'?,Elena Anaya
Who acted as Rita Thornton in the movie 'The Vow'?,Jessica Lange
Who acted as Adam in the movie 'Excision'?,Jeremy Sumpter
Who acted as Tai Yue in the movie 'Kung Fu Jungle'?,Deep Ng
Who acted as Sonora Webster in the movie 'Wild Hearts Can't Be Broken'?,Gabrielle Anwar
Who acted as Shiro Nishi in the movie 'Whisper of the Heart'?,Keiju Kobayashi
Who acted as Rasmeusen in the movie 'The Longest Yard'?,Mike Henry
Who acted as The King in the movie 'The Little Prince'?,Joss Ackland
Who acted as Bragg in the movie 'Ghost Machine'?,Josh Dallas
Who acted as Kisha in the movie 'A Haunted House 2'?,Essence Atkins
Who acted as Hache in the movie 'Three Steps Above Heaven'?,Mario Casas
Who acted as Agent Dave Grant in the movie 'Echelon Conspiracy'?,Ving Rhames
Who acted as Margot in the movie 'Margot at the Wedding'?,Nicole Kidman
Who acted as Regina Jackson in the movie 'The Day the Earth Stood Still'?,Kathy Bates
Who acted as Hubbell Gardner in the movie 'The Way We Were'?,Robert Redford
Who acted as Kramer in the movie 'Inspector Gadget'?,Andy Dick
Who acted as Elliot in the movie 'Bellflower'?,Zack Kraus
Who acted as Nick in the movie 'Make Your Move'?,Wesley Jonathan
Who acted as Dr. Corso in the movie 'Parasomnia'?,Timothy Bottoms
Who acted as Hector Enderby in the movie 'Murder at the Gallop'?,Robert Morley
Who acted as Skip Gibbs in the movie 'Freaky Deaky'?,Christian Slater
Who acted as Aiden in the movie 'Bellflower'?,Tyler Dawson
Who acted as Ellen Juba in the movie 'The Distinguished Gentleman'?,Susan Forristal
Who acted as Nachalnik gospitalya in the movie 'White Tiger'?,Vladimir Ilin
Who acted as Jack Delorean in the movie 'The Walker'?,Ned Beatty
Who acted as Pearl Harper in the movie 'The Night of the Hunter'?,Sally Jane Bruce
Who acted as Ace in the movie 'Failure to Launch'?,Justin Bartha
Who acted as Nick Malloy in the movie '12 Rounds 2: Reloaded'?,Randy Orton
Who acted as Clifford Sterling in the movie 'Honey I Blew Up the Kid'?,Lloyd Bridges
Who acted as Leonidas in the movie 'Meet the Spartans'?,Sean Maguire
Who acted as Sing in the movie 'Shaolin Soccer'?,Stephen Chow
Who acted as Susan Watkins in the movie 'Open Water'?,Blanchard Ryan
Who acted as Jeremy Reins in the movie 'Brake'?,Stephen Dorff
Who acted as Elaine Morris in the movie 'Ouija'?,Olivia Cooke
Who acted as Selena Perrini in the movie 'Collateral Damage'?,Francesca Neri
Who acted as Everett Stone in the movie 'The Family Stone'?,Dermot Mulroney
Who acted as John Henderson in the movie 'Mother'?,Albert Brooks
Who acted as Topher in the movie 'Love and Honor'?,Wyatt Russell
Who acted as Dr. Gideon Gault in the movie 'Premature Burial'?,Alan Napier
Who acted as Daniel Longdale in the movie '8MM'?,Anthony Heald
Who acted as Sam Burns in the movie 'Terms of Endearment'?,John Lithgow
Who acted as Elvira Smollett in the movie 'Bunny Lake Is Missing'?,Anna Massey
Who acted as Father Meyers in the movie 'Phantasm II'?,Kenneth Tigar
Who acted as Jake Dunmore in the movie 'Goodbye Lover'?,Dermot Mulroney
Who acted as John McClane in the movie 'A Good Day to Die Hard'?,Bruce Willis
Who acted as The Young Girl in the movie 'The Lover'?,Jane March
Who acted as Brett Gregory in the movie 'Goodbye Bafana'?,Shiloh Henderson
Who acted as Beatrice Taylor in the movie 'After.Life'?,Celia Weston
Who acted as Scott Voss in the movie 'Here Comes the Boom'?,Kevin James
Who acted as Gloria Swenson in the movie 'Gloria'?,Gena Rowlands
Who acted as Jason in the movie 'Step Up Revolution'?,Stephen Boss
Who acted as Hallie Parker / Annie James in the movie 'The Parent Trap'?,Lindsay Lohan
Who acted as Ellen Martin in the movie 'A Lot Like Love'?,Taryn Manning
Who acted as Jesse Fisher in the movie 'Liberal Arts'?,Josh Radnor
Who acted as Nancy B. Artingstall in the movie 'Spy'?,Miranda Hart
Who acted as Veronica in the movie 'Femme Fatale'?,Rie Rasmussen
Who acted as Charlie in the movie 'Down in the Valley'?,Bruce Dern
Who acted as Pvt. Kem in the movie 'Cross of Iron'?,Vadim Glowna
Who acted as Amy Sumner in the movie 'Straw Dogs'?,Kate Bosworth
Who acted as Roy Edwards in the movie 'Welcome to the Punch'?,Peter Mullan
Who acted as Willie in the movie 'Electra Glide in Blue'?,Elisha Cook Jr.
Who acted as Wednesday Addams in the movie 'The Addams Family'?,Christina Ricci
Who acted as Mei in the movie 'Outcast'?,Summer Jike
Who acted as Himself in the movie 'His Name Was Jason: 30 Years of Friday the 13th'?,Steven Barton
Who acted as Avery Chasten in the movie 'Suicide Kings'?,Henry Thomas
Who acted as Lady Campanula Tottington in the movie 'The Curse of the Were-Rabbit'?,Helena Bonham Carter
Who acted as Cadet Lt. Col. Brett C. Shelton in the movie 'Child's Play 3'?,Travis Fine
Who acted as Dylan Mitchell in the movie 'Courageous'?,Rusty Martin
Who acted as Clara Webb in the movie 'Byzantium'?,Gemma Arterton
Who acted as Crawl in the movie 'Son in Law'?,Pauly Shore
"Who acted as Hunter Henderson in the movie 'Paris, Texas'?",Hunter Carson
Who acted as Elizabeth Harris in the movie 'Unknown'?,January Jones
Who acted as Caya in the movie 'Unearthed'?,Beau Garrett
Who acted as Lisa in the movie 'Wicked Little Things'?,Julie Rogers
Who acted as Mike Whittier in the movie 'Hitman'?,Dougray Scott
Who acted as Fenella in the movie 'Absolutely Anything'?,Joanna Lumley
Who acted as Flora in the movie 'The Innocents'?,Pamela Franklin
Who acted as Kaitlin in the movie 'Van Wilder: Freshman Year'?,Kristin Cavallari
Who acted as Messaoud Souni in the movie 'Days of Glory'?,Roschdy Zem
Who acted as Chun-Li in the movie 'Street Fighter: The Legend of Chun-Li'?,Kristin Kreuk
Who acted as Randall in the movie 'Prime'?,Zak Orth
Who acted as Ruby in the movie 'Summer of Sam'?,Jennifer Esposito
Who acted as Charlie Wolfe in the movie 'Kill Me Three Times'?,Simon Pegg
Who acted as Chief Paul Schaeffer in the movie 'Witness'?,Josef Sommer
Who acted as Francis Fitzpatrick in the movie 'She's the One'?,Michael McGlone
Who acted as Exeter in the movie 'Henry V'?,Brian Blessed
Who acted as Dr. Emma Lloyd in the movie 'The Accidental Husband'?,Uma Thurman
Who acted as John Casey in the movie 'Bobby'?,Anthony Hopkins
Who acted as Ma Stone in the movie 'The Devil and Daniel Webster'?,Jane Darwell
Who acted as Kate in the movie 'Very Good Girls'?,Demi Moore
Who acted as Rabbi in the movie 'Moonlight Mile'?,Richard Messing
Who acted as Felipe in the movie 'Jack and Jill'?,Eugenio Derbez
Who acted as Heather Baylor in the movie 'Elizabethtown'?,Judy Greer
Who acted as Chugtai Khan in the movie 'Jodhaa Akbar'?,Rajesh Vivek
Who acted as Morton in the movie 'First Kid'?,Art LaFleur
Who acted as Francis in the movie 'The Last House on the Left'?,Aaron Paul
Who acted as Tuag in the movie '2047: Sights of Death'?,Neva Leoni
Who acted as Rain in the movie 'Resident Evil'?,Michelle Rodriguez
Who acted as Tarconi in the movie 'The Transporter'?,François Berléand
Who acted as Jim Deer Jackson in the movie 'The Getaway'?,David Morse
Who acted as Pauline in the movie 'Lucky'?,Ann-Margret
Who acted as Jack Menken in the movie 'Man of the Year'?,Christopher Walken
Who acted as Tomkins in the movie '13 Eerie'?,Michael Shanks
Who acted as Stephen in the movie 'The Roommate'?,Cam Gigandet
Who acted as Paul in the movie 'Funny Games'?,Arno Frisch
Who acted as Bibble / Fungus 1 & 2 in the movie 'Barbie Fairytopia: Mermaidia'?,Lee Tockar
Who acted as Catherine Van Oost in the movie 'Five Easy Pieces'?,Susan Anspach
Who acted as Jeff Warren in the movie 'Human Desire'?,Glenn Ford
Who acted as Llaves in the movie 'Catacombs'?,Sandi Dragoi
Who acted as Sarah Abramoff in the movie 'Casino Jack'?,Hannah Endicott-Douglas
Who acted as Francesca Fachini in the movie 'Assassination of a High School President'?,Mischa Barton
Who acted as Little Girl in the movie 'Children of the Corn'?,Lexie Behr
Who acted as Drayton Sawyer in the movie 'Texas Chainsaw 3D'?,Bill Moseley
Who acted as Madame Piasco in the movie 'Caprice'?,Lilia Skala
Who acted as Karen Clarke / Susan Hamilton in the movie 'Dark Corners'?,Thora Birch
Who acted as DG in the movie 'Tin Man'?,Zooey Deschanel
Who acted as Balrog in the movie 'Street Fighter: The Legend of Chun-Li'?,Michael Clarke Duncan
Who acted as Dr. David Ravell/George McCord in the movie 'Nurse Betty'?,Greg Kinnear
Who acted as Amelia Earhart in the movie 'Night at the Museum: Battle of the Smithsonian'?,Amy Adams
Who acted as Colonel Bockner in the movie 'King Solomon's Mines'?,Herbert Lom
Who acted as Doug Glatt in the movie 'Goon'?,Seann William Scott
Who acted as Töre in the movie 'The Virgin Spring'?,Max von Sydow
Who acted as Johanna Parry in the movie 'Hateship Loveship'?,Kristen Wiig
Who acted as Max in the movie 'Midnight Express'?,John Hurt
Who acted as Sally Hirst in the movie 'Don't Be Afraid of the Dark'?,Bailee Madison
Who acted as Dr. Jane Simmons in the movie 'I Origins'?,Cara Seymour
"Who acted as K.C., Cherry Bomb in the movie 'Howard the Duck'?",Holly Robinson Peete
Who acted as Sheriff Terri Frankel in the movie 'Splinter'?,Laurel Whitsett
Who acted as Chang-wook in the movie 'Haemoo'?, Lee Hee-joon
Who acted as Dawes in the movie 'The Man Who Loved Cat Dancing'?,Jack Warden
Who acted as Caryn in the movie 'Cheap Thrills'?,Laura Covelli
Who acted as Susan Evans in the movie 'The Good Son'?,Wendy Crewson
Who acted as Jimmy Flynt in the movie 'The People vs. Larry Flynt'?,Brett Harrelson
Who acted as Frank Levin in the movie 'The Lincoln Lawyer'?,William H. Macy
Who acted as Laura J. Kelly in the movie 'Legal Eagles'?,Debra Winger
Who acted as Finlay in the movie 'The Railway Man'?,Stellan Skarsgård
Who acted as Guy Singer in the movie 'The Bank Job'?,James Faulkner
Who acted as David in the movie 'The Numbers Station'?,Bryan Dick
Who acted as Ariel Wolfe in the movie 'Return to House on Haunted Hill'?,Amanda Righetti
Who acted as Buck Grotowski in the movie 'Monster's Ball'?,Peter Boyle
Who acted as Jack Travis in the movie 'Lethal Weapon 3'?,Stuart Wilson
Who acted as Virgilia in the movie 'Coriolanus'?,Jessica Chastain
Who acted as Ash in the movie 'Bachelor Party Vegas'?,Donald Faison
Who acted as Shiori Kitano in the movie 'Battle Royale II: Requiem'?,Ai Maeda
Who acted as Julia Hart in the movie '2012: Ice Age'?,Katie Wilson
Who acted as Daniel Collins in the movie 'Eulogy'?,Hank Azaria
Who acted as Roger Chillingworth in the movie 'The Scarlet Letter'?,Robert Duvall
Who acted as Mr. Sam Beauregarde in the movie 'Willy Wonka & the Chocolate Factory'?,Leonard Stone
Who acted as Mr. Bryles in the movie 'Class of 1999'?,Patrick Kilpatrick
Who acted as Agent Rogersz in the movie 'Repo Man'?,Susan Barnes
Who acted as Billy in the movie 'Severance'?,Babou Ceesay
Who acted as Irina in the movie 'The Cranes Are Flying'?,Svetlana Kharitonova
Who acted as Bob Lee Swagger in the movie 'Shooter'?,Mark Wahlberg
Who acted as Hilly in the movie 'Weird Science'?,Judie Aronson
Who acted as Himself in the movie 'The Celluloid Closet'?,Antonio Fargas
Who acted as Alma in the movie 'Tie Me Up! Tie Me Down!'?,Julieta Serrano
Who acted as Eleanor in the movie 'Birth'?,Lauren Bacall
Who acted as Aram Finklestein in the movie 'The Rebound'?,Justin Bartha
Who acted as  in the movie 'Jack and the Cuckoo-Clock Heart'?,Jean Rochefort
Who acted as Simon in the movie 'Simon'?,Alan Arkin
Who acted as Erik Ponti in the movie 'Evil'?,Andreas Wilson
Who acted as Víctor Plaza in the movie 'Live Flesh'?,Liberto Rabal
Who acted as Scoonie Schofield in the movie 'Neighbors'?,Christopher Mintz-Plasse
Who acted as Mel Bakersfeld in the movie 'Airport'?,Burt Lancaster
Who acted as Gary in the movie 'Joe'?,Tye Sheridan
Who acted as Alfredo Berlinghieri in the movie '1900'?,Robert De Niro
Who acted as Lugs Harvey in the movie 'Stroker Ace'?,Jim Nabors
Who acted as Vernon Hightower in the movie 'Nadine'?,Jeff Bridges
Who acted as Douglas Benham in the movie 'A Child Is Waiting'?,Lawrence Tierney
Who acted as Joe Cabot in the movie 'Reservoir Dogs'?,Lawrence Tierney
Who acted as Edward in the movie 'Hansel & Gretel: Witch Hunters'?,Derek Mears
Who acted as Mormon Boy #1 in the movie 'The Strangers'?,Alex Fisher
Who acted as Dave in the movie 'Lost River'?,Ben Mendelsohn
Who acted as Nia in the movie 'Equals'?,Kristen Stewart
Who acted as Charlie in the movie 'The Cave'?,Piper Perabo
Who acted as Nicholas St. Downs III in the movie 'Airport '77'?,Joseph Cotten
Who acted as Lily Dollar in the movie 'Warlock'?,Dorothy Malone
Who acted as Grip in the movie 'The Last of Robin Hood'?,Sean Flynn
"Who acted as Warner, the chauffeur in the movie 'The Bat'?",John Sutton
Who acted as Iris Du Pré in the movie 'Hilary and Jackie'?,Celia Imrie
Who acted as Nina in the movie 'The Family Tree'?,Gabrielle Anwar
Who acted as Scud in the movie 'Blade II'?,Norman Reedus
Who acted as Vic Trenton in the movie 'Cujo'?,Daniel Hugh Kelly
"Who acted as Midori Nonomiya in the movie 'Like Father, Like Son'?",Machiko Ono
Who acted as Himself in the movie 'Paper Heart'?,Michael Cera
Who acted as Janet in the movie 'Stoned'?,Amelia Warner
Who acted as Herself - US Marine Corps in the movie 'The Invisible War'?,Elle Helmer
Who acted as Nina in the movie 'The Scapegoat'?,Sheridan Smith
Who acted as Sukie Ridgemont in the movie 'The Witches of Eastwick'?,Michelle Pfeiffer
Who acted as Mr. Longbaugh in the movie 'The Way of the Gun'?,Benicio del Toro
Who acted as Ed Peters in the movie 'Ghosts of Mississippi'?,Craig T. Nelson
Who acted as Rutherford in the movie 'Risky Business'?,Richard Masur
"Who acted as Daniel LaRusso in the movie 'The Karate Kid, Part III'?",Ralph Macchio
Who acted as Steve in the movie 'Begin Again'?,James Corden
Who acted as Paul Prior in the movie 'In My Father's Den'?,Matthew Macfadyen
Who acted as Ashley in the movie 'Born To Race'?,Sara Swain
Who acted as Marley Neville in the movie 'I Am Legend'?,Willow Smith
Who acted as Mikhail Polenin in the movie 'K-19: The Widowmaker'?,Liam Neeson
Who acted as Ma-Ma in the movie 'Dredd'?,Lena Headey
Who acted as Chloé Girard in the movie 'My Old Lady'?,Kristin Scott Thomas
Who acted as J.J. Blodgett in the movie 'Avanti!'?,Edward Andrews
Who acted as Simon in the movie 'True Lies'?,Bill Paxton
Who acted as Farley in the movie 'Van Wilder: Freshman Year'?,Nestor Aaron Absera
Who acted as Leslie Burke in the movie 'Bridge to Terabithia'?,AnnaSophia Robb
Who acted as Nancy Mercer in the movie 'Shattered'?,Debi A. Monahan
Who acted as Bridges in the movie 'The Trials of Cate McCall'?,Nick Nolte
Who acted as Gerry in the movie 'City of the Living Dead'?,Carlo De Mejo
Who acted as Susan Williams in the movie 'The Grudge'?,KaDee Strickland
Who acted as Obaid in the movie 'Flightplan'?,Michael Irby
Who acted as Al Alvarez in the movie 'Sylvia'?,Jared Harris
Who acted as Marty Mikalski in the movie 'The Cabin in the Woods'?,Fran Kranz
Who acted as Rusty in the movie 'Battle For SkyArk'?,Garrett Coffey
Who acted as Beatrix in the movie '1492: Conquest of Paradise'?,Ángela Molina
Who acted as Jason in the movie 'Because I Said So'?,Tom Everett Scott
Who acted as Andrzej in the movie 'Knife in the Water'?,Leon Niemczyk
Who acted as Grace Connelly in the movie 'Bruce Almighty'?,Jennifer Aniston
Who acted as Úrsula in the movie 'Sleep Tight'?,Iris Almeida
Who acted as Viola De Lesseps in the movie 'Shakespeare in Love'?,Gwyneth Paltrow
Who acted as Fairchild in the movie 'Sabrina'?,John Wood
Who acted as Newberry in the movie 'Disturbing Behavior'?,William Sadler
Who acted as Eli Lapp in the movie 'Witness'?,Jan Rubes
Who acted as Kit in the movie 'Failure to Launch'?,Zooey Deschanel
Who acted as  in the movie 'CRAZY'?,Pierre-Luc Brillant
Who acted as Rothgar in the movie 'Outlander'?,John Hurt
Who acted as Nanny in the movie '101 Dalmatians'?,Joan Plowright
Who acted as Samayel in the movie 'The Prophecy II'?,Glenn Danzig
Who acted as Maggie in the movie 'The Women'?,Cloris Leachman
Who acted as Insp. Harry Calahan in the movie 'Magnum Force'?,Clint Eastwood
Who acted as Simon in the movie 'Rogue'?,Stephen Curry
Who acted as David Spritz in the movie 'The Weather Man'?,Nicolas Cage
Who acted as Nathan Hayes in the movie 'Courageous'?,Ken Bevel
Who acted as Fritz Curtis in the movie 'Baby Boom'?,Sam Wanamaker
Who acted as Max Simkin in the movie 'The Cobbler'?,Adam Sandler
Who acted as Jean Pierre Le Pelt in the movie '102 Dalmatians'?,Gérard Depardieu
Who acted as Mrs. Smalls in the movie 'Big Nothing'?,Mimi Rogers
Who acted as Stacy in the movie 'Extreme Movie'?,Cherilyn Wilson
Who acted as Violet Devereaux in the movie 'The Skeleton Key'?,Gena Rowlands
Who acted as Theodore Roosevelt in the movie 'The Wind and the Lion'?,Brian Keith
Who acted as Christophe in the movie 'The Serpent and the Rainbow'?,Conrad Roberts
Who acted as Sam in the movie 'Happythankyoumoreplease'?,Josh Radnor
Who acted as Rarity / Princess Luna in the movie 'My Little Pony: Equestria Girls'?,Tabitha St. Germain
Who acted as Joichiro Nishi in the movie 'Gantz: Perfect Answer'?,Kanata Hongo
Who acted as Frank Dux in the movie 'Bloodsport'?,Jean-Claude Van Damme
