Question,Answer
Who acted as Gina in the movie 'Code Name: The Cleaner'?,Lucy Liu
Who acted as George Taylor in the movie 'Planet of the Apes'?,Charlton Heston
Who acted as Sojiro Seta in the movie 'Rurouni Kenshin: The Legend Ends'?,Ryunosuke Kamiki
Who acted as Rick Latimer in the movie 'The Principal'?,Jim Belushi
Who acted as Eric Applebaum in the movie 'Mr. Magorium's Wonder Emporium'?,Zach Mills
Who acted as Chuck Wein in the movie 'Factory Girl'?,Jimmy Fallon
Who acted as Sam in the movie 'Blow Out'?,Peter Boyden
Who acted as Sarah Whittle in the movie 'Jumanji'?,Bonnie Hunt
Who acted as Irina in the movie 'A Good Day to Die Hard'?,Юлия Снигирь
Who acted as Leila in the movie 'Repo Man'?,Olivia Barash
Who acted as Philipp in the movie 'The Substitute'?,Nikolaj Falkenberg-Klok
Who acted as Steve Jones in the movie 'The Joneses'?,David Duchovny
Who acted as Bernardo in the movie 'Virgin Territory'?,Jay Villiers
Who acted as Allan Deveneux in the movie 'No Mercy'?,William Atherton
Who acted as Kate Bass in the movie 'Wind'?,Jennifer Grey
Who acted as Spectator in the movie 'My Dog Skip'?,Chaon Cross
Who acted as Milly in the movie 'Because I Said So'?,Mandy Moore
Who acted as Cynthia in the movie 'Couples Retreat'?,Kristen Bell
Who acted as Constance Trentham in the movie 'Gosford Park'?,Maggie Smith
Who acted as Josh in the movie 'I Give It a Year'?,Rafe Spall
Who acted as Raoul Minot in the movie 'The American Friend'?,Gérard Blain
Who acted as Weeping Veteran in the movie 'Closing the Ring'?,Gene Dinovi
Who acted as Pfc. Windy Craven in the movie 'A Walk in the Sun'?,John Ireland
Who acted as Ted in the movie 'Anywhere But Here'?,Ray Baker
Who acted as Hélène Ledoux in the movie 'Repulsion'?,Yvonne Furneaux
Who acted as Cody in the movie 'Return of the Living Dead: Rave to the Grave'?,Cory Hardrict
Who acted as Frank in the movie 'The Other Woman'?,Don Johnson
Who acted as Deacon Moss in the movie 'The Longest Yard'?,Michael Irvin
Who acted as Glory in the movie 'North Country'?,Frances McDormand
Who acted as Capt. Tom Wilder in the movie 'Blood Alley'?,John Wayne
Who acted as Margareth Hunter in the movie 'Farinelli'?,Caroline Cellier
Who acted as Dr. William Weir in the movie 'Event Horizon'?,Sam Neill
Who acted as Peter in the movie 'Dawn of the Dead'?,Ken Foree
Who acted as Dr. Worley / Nome King in the movie 'Return to Oz'?,Nicol Williamson
Who acted as Norm Cahill in the movie 'The Box'?,James Rebhorn
Who acted as Zelda in the movie 'Everly'?,Caroline Chikezie
Who acted as Jean Valjean in the movie 'Les Misérables'?,Richard Jordan
Who acted as Ebba in the movie 'Force Majeure'?,Lisa Loven Kongsli
Who acted as Howard Howe in the movie 'Tusk'?,Michael Parks
Who acted as Tim Lake in the movie 'About Time'?,Domhnall Gleeson
Who acted as  in the movie 'House of Flying Daggers'?,Guo Jun
Who acted as Clive in the movie 'The Man Who Knew Too Much'?,Hugh Wakefield
Who acted as Floatie Dupre in the movie 'Box of Moonlight'?,Catherine Keener
Who acted as Various characters in the movie 'South Park: Imaginationland'?,Matt Stone
Who acted as Guzmán in the movie '[REC]⁴ Apocalypse'?,Paco Manzanedo
Who acted as Danny Garrett in the movie 'Children of the Corn II: The Final Sacrifice'?,Paul Scherrer
Who acted as Maggie Murphy in the movie 'Just Go with It'?,Bailee Madison
Who acted as Goat in the movie 'Doom'?,Ben Daniels
Who acted as Jack Taylor in the movie 'Kill Me Three Times'?,Callan Mulvey
Who acted as Guy in the movie 'The Umbrellas of Cherbourg'?,Nino Castelnuovo
Who acted as Gunnery Sergeant James Dunn in the movie 'Most Wanted'?,Keenen Ivory Wayans
Who acted as Michelle in the movie 'Boy A'?,Katie Lyons
Who acted as Maria in the movie 'Courage Under Fire'?,Michole Briana White
Who acted as Penny in the movie 'Inspector Gadget'?,Michelle Trachtenberg
Who acted as Warden Gasque in the movie 'Big Stan'?,Scott Wilson
Who acted as Watch in the movie 'Robots'?,Paula Abdul
Who acted as Bobby in the movie 'Blue Valentine'?,Mike Vogel
Who acted as Nobuo Kataoka in the movie 'Still Walking'?,Kazuya Takahashi
Who acted as Alan Garner in the movie 'The Hangover Part II'?,Zach Galifianakis
Who acted as Mary Sunshine in the movie 'Chicago'?,Christine Baranski
Who acted as Edgar West in the movie 'Confessions of a Shopaholic'?,John Lithgow
Who acted as Patricia Guilford in the movie 'Danika'?,Akuyoe Graham
Who acted as Melissa Peyser in the movie 'The In-Laws'?,Lindsay Sloane
Who acted as Leann Cole in the movie 'One Missed Call'?,Azura Skye
Who acted as Christine Darbon in the movie 'Stolen Kisses'?,Claude Jade
Who acted as Chet in the movie 'Faces'?,Seymour Cassel
Who acted as Jim in the movie 'Assault on Wall Street'?,Dominic Purcell
Who acted as Kathleen Morgan in the movie 'Just Before I Go'?,Kate Walsh
Who acted as Tommy Nelson in the movie 'Abbott and Costello Meet the Invisible Man'?,Arthur Franz
Who acted as Tom Carver in the movie 'Even Money'?,Ray Liotta
Who acted as Becky in the movie 'Return of the Living Dead: Rave to the Grave'?,Aimee-Lynn Chadwick
Who acted as Dr. Terry McCormick in the movie 'Mega Shark vs. Crocosaurus'?,Jaleel White
Who acted as Girolamo Aleander in the movie 'Luther'?,Jonathan Firth
Who acted as Jom Rachan in the movie 'Ong Bak 3'?,Sarunyu Wongkrachang
Who acted as Katharine in the movie 'Restoration'?,Meg Ryan
Who acted as Merrill Hess in the movie 'Signs'?,Joaquin Phoenix
Who acted as Bob in the movie 'The Woodsman'?,David Alan Grier
Who acted as Larry Kelson in the movie 'Two Weeks Notice'?,Robert Klein
Who acted as Gina Selway in the movie 'Welcome to Me'?,Linda Cardellini
Who acted as Janet Morello in the movie 'Haunt'?,Jacki Weaver
Who acted as Zoe Stevens in the movie 'The Sweet Hereafter'?,Caerthan Banks
"Who acted as Sidonie Laborde in the movie 'Farewell, My Queen'?",Léa Seydoux
Who acted as Alicia in the movie 'Magic Magic'?,Juno Temple
Who acted as Slade in the movie 'The MacKintosh Man'?,Ian Bannen
Who acted as John Morgan in the movie 'A Man Called Horse'?,Richard Harris
Who acted as Helen Thomas Webber in the movie 'Blast from the Past'?,Sissy Spacek
Who acted as Dora in the movie 'A Dog's Will'?,Denise Fraga
Who acted as Evra the Snake Boy in the movie 'Cirque du Freak: The Vampire's Assistant'?,Patrick Fugit
Who acted as David Walker in the movie 'Angels Sing'?,Chandler Canterbury
Who acted as Amelia in the movie 'The Ghost Writer'?,Kim Cattrall
Who acted as Elizabeth Bennet in the movie 'Pride & Prejudice'?,Keira Knightley
Who acted as Danny in the movie 'Wrong Turn 6: Last Resort'?,Anthony Ilott
Who acted as Rennes in the movie 'Cube'?,Wayne Robson
Who acted as Prof. Bernard Quatermass in the movie 'Quatermass and the Pit'?,Andrew Keir
Who acted as Raylene Stein in the movie 'Keeping Up with the Steins'?,Sandra Taylor
Who acted as Grace Augustine in the movie 'Avatar 2'?,Sigourney Weaver
Who acted as Agustina in the movie 'Volver'?,Blanca Portillo
Who acted as Roger Marcus in the movie 'Barely Lethal'?,Thomas Mann
Who acted as Hope in the movie 'Mean Girls 2'?,Nicole Gale Anderson
Who acted as Mr. Walker in the movie 'Supremacy'?,Danny Glover
Who acted as Dr Liz Draper in the movie 'The Dinosaur Project'?,Natasha Loring
Who acted as Rose in the movie 'Daddy and Them'?,Kelly Preston
Who acted as Greg in the movie 'Children of the Corn V: Fields of Terror'?,Alexis Arquette
Who acted as Juliens Mutter in the movie 'Tender Cousins'?,Macha Méril
Who acted as Dapper Guy in the movie 'Kevin Hart: Let Me Explain'?,David Terrell
Who acted as Agent Hutchinson in the movie 'Mega Shark vs. Crocosaurus'?,Sarah Lieving
Who acted as Linda Green in the movie 'Addicted to Love'?,Kelly Preston
Who acted as Nicole Walker in the movie 'Fear'?,Reese Witherspoon
Who acted as Abby Fletcher in the movie 'The Factory'?,Mae Whitman
Who acted as Esther in the movie 'In the House'?,Emmanuelle Seigner
Who acted as Jason Crockett in the movie 'Frogs'?,Ray Milland
Who acted as Masu in the movie 'On Deadly Ground'?,Joan Chen
Who acted as Jay Porter in the movie '...And Justice for All'?,Jeffrey Tambor
Who acted as Barney Cousins in the movie 'The Vanishing'?,Jeff Bridges
Who acted as Chris Hooker in the movie 'The Craft'?,Skeet Ulrich
Who acted as Dash in the movie 'First Kid'?,Blake Boyd
Who acted as Tom in the movie 'Cry_Wolf'?,Jared Padalecki
Who acted as Mike Fleming in the movie 'The Watcher in the Woods'?,Benedict Taylor
Who acted as Henry in the movie 'Crazy Kind of Love'?,Graham Rogers
Who acted as Howard Finnigan in the movie 'Short Cuts'?,Bruce Davison
Who acted as Sleeping Beauty in the movie 'Avengers Grimm'?,Marah Fairclough
Who acted as Jackie Dorsey in the movie 'The Cutting Edge: Going for the Gold'?,Christy Carlson Romano
Who acted as Ernest Weller in the movie 'Repossessed'?,Ned Beatty
Who acted as Greta Ohlson in the movie 'Murder on the Orient Express'?,Ingrid Bergman
Who acted as Memnon in the movie 'The Scorpion King'?,Steven Brand
Who acted as Ayisha Lebaron in the movie 'Marilyn Hotchkiss' Ballroom Dancing & Charm School'?,Octavia Spencer
Who acted as Kaulder in the movie 'The Last Witch Hunter'?,Vin Diesel
Who acted as Himself in the movie 'The Pixar Story'?,John Lasseter
Who acted as Lily Reed in the movie 'Paradise'?,Melanie Griffith
Who acted as Stith in the movie 'Titan A.E.'?,Janeane Garofalo
Who acted as Eddie Kreezer in the movie 'Hick'?,Eddie Redmayne
Who acted as Izzy in the movie 'Moms' Night Out'?,Logan White
Who acted as James Papadopoulos in the movie 'Papadopoulos & Sons'?,Frank Dillane
Who acted as Moe Williams in the movie 'Pickup on South Street'?,Thelma Ritter
Who acted as Mitch Wilson in the movie 'The Campaign'?,Jason Sudeikis
Who acted as Emily in the movie 'American Heist'?,Jordana Brewster
Who acted as Tom Garvey in the movie 'The River'?,Mel Gibson
Who acted as Speed Racer in the movie 'Speed Racer'?,Emile Hirsch
Who acted as Salt in the movie 'Outbreak'?,Cuba Gooding Jr.
Who acted as Lester Vesco in the movie 'Big Momma's House'?,Terrence Howard
Who acted as Mike Tobacco in the movie 'Killer Klowns from Outer Space'?,Grant Cramer
Who acted as Buck Zorba in the movie '13 Ghosts'?,Charles Herbert
Who acted as James in the movie 'Banshee Chapter'?,Michael McMillian
Who acted as Joan Hart in the movie 'Damien: Omen II'?,Elizabeth Shepherd
Who acted as Uncle Fester Addams in the movie 'Addams Family Values'?,Christopher Lloyd
Who acted as George Grierson in the movie 'Bean'?,Harris Yulin
Who acted as Commissaire Juve in the movie 'Fantomas Unleashed'?,Louis de Funès
Who acted as Karen in the movie 'I Origins'?,Brit Marling
Who acted as Richie Avery in the movie 'Bigger Than Life'?,Christopher Olsen
Who acted as Katherine in the movie 'Henry V'?,Emma Thompson
Who acted as Dagen in the movie 'Mythica: A Quest for Heroes'?,Jake Stormoen
Who acted as Suzi Brent in the movie 'Valley Girl'?,Michelle Meyrink
Who acted as Oraz in the movie 'Nomad: The Warrior'?,Jason Scott Lee
Who acted as Ping in the movie 'Seventh Moon'?,Dennis Chan
Who acted as Mother in the movie 'Dogtooth'?,Michele Valley
Who acted as Jimmy Gator in the movie 'Magnolia'?,Philip Baker Hall
Who acted as  in the movie 'Jodorowsky's Dune'?,H.R. Giger
Who acted as Sam Hallaway in the movie 'Surveillance'?,Bill Pullman
Who acted as Betty Rizzo in the movie 'Grease'?,Stockard Channing
Who acted as Molly in the movie 'Home Alone 4'?,Barbara Babcock
Who acted as Captain Dan Tiger in the movie 'Pickup on South Street'?,Murvyn Vye
"Who acted as Jazz Sängerin in the movie 'Good Night, and Good Luck.'?",Dianne Reeves
Who acted as Steven Crighton in the movie 'Daylight'?,Jay O. Sanders
Who acted as Bernie Lootz in the movie 'The Cooler'?,William H. Macy
Who acted as Ryan Carmichael in the movie 'Eulogy'?,Jesse Bradford
Who acted as Abbie Grainger in the movie 'One Magic Christmas'?,Elisabeth Harnois
Who acted as Fantine in the movie 'Les Misérables'?,Uma Thurman
Who acted as Bob Jenkins in the movie 'The Langoliers'?,Dean Stockwell
Who acted as Ted Logan in the movie 'Bill & Ted's Excellent Adventure'?,Keanu Reeves
Who acted as Marshall in the movie 'Joe Versus the Volcano'?,Ossie Davis
Who acted as Angela Dodson / Isabel Dodson in the movie 'Constantine'?,Rachel Weisz
Who acted as James Bond in the movie 'Goldfinger'?,Sean Connery
Who acted as Leslie in the movie 'Our Man Flint'?,Shelby Grant
Who acted as Arnold Poindexter in the movie 'Revenge of the Nerds II: Nerds in Paradise'?,Timothy Busfield
Who acted as Dr. Raymond Cocteau in the movie 'Demolition Man'?,Nigel Hawthorne
Who acted as The Stranger in the movie 'High Plains Drifter'?,Clint Eastwood
Who acted as Tom Engel in the movie 'Krampus'?,Adam Scott
Who acted as Henrik Sandahl in the movie 'The Danish Girl'?,Ben Whishaw
Who acted as Shaggy in the movie 'Scooby-Doo! The Mystery Begins'?,Nick Palatas
Who acted as Walker in the movie 'Thirteen Conversations About One Thing'?,John Turturro
Who acted as Ida in the movie 'Antboy'?,Amalie Kruse Jensen
Who acted as Martin Q. Blank in the movie 'Grosse Pointe Blank'?,John Cusack
Who acted as Karl in the movie 'Frontier(s)'?,Patrick Ligardes
Who acted as Dana Barrett in the movie 'Ghostbusters II'?,Sigourney Weaver
Who acted as Chloe Richards in the movie 'Blind Horizon'?,Neve Campbell
Who acted as David in the movie 'Wheels on Meals'?,Yuen Biao
Who acted as Martha Farnsworth in the movie 'The Beguiled'?,Geraldine Page
Who acted as Vicki Buckley in the movie 'Human Desire'?,Gloria Grahame
Who acted as Felix Davison in the movie 'You're Next'?,Nicholas Tucci
Who acted as Le Colonel Solitaire in the movie 'A Pigeon Sat on a Branch Reflecting on Existence'?,Jonas Gerholm
Who acted as Dillon in the movie 'Alien³'?,Charles S. Dutton
Who acted as Morgan in the movie 'The Texas Chainsaw Massacre'?,Jonathan Tucker
Who acted as Himself in the movie 'Bowling for Columbine'?,George W. Bush
Who acted as Chester Conway in the movie 'The Killer Inside Me'?,Ned Beatty
Who acted as Lady Silk in the movie 'The Man with the Iron Fists'?,Jamie Chung
Who acted as Dean in the movie 'The Texas Chainsaw Massacre: The Beginning'?,Taylor Handley
Who acted as Simon in the movie 'The Grand Seduction'?,Gordon Pinsent
Who acted as Nazeer Choudhury in the movie 'SubUrbia'?,Ajay Naidu
Who acted as Principal Garcia in the movie 'One Eight Seven'?,Tony Plana
Who acted as Conchita Izquierdo in the movie '[REC]'?,Martha Carbonell
Who acted as Edith Olson in the movie 'Motel Hell'?,Elaine Joyce
Who acted as Hank in the movie 'The Panic in Needle Park'?,Richard Bright
Who acted as Isabel in the movie 'The Backwoods'?,Aitana Sánchez-Gijón
Who acted as Himself in the movie 'The Internet's Own Boy: The Story of Aaron Swartz'?,Aaron Swartz
Who acted as Miss Heliotrope in the movie 'The Secret of Moonacre'?,Juliet Stevenson
Who acted as Ghost in the movie 'Hamlet'?,Sam Shepard
Who acted as Loki in the movie 'Thor: Ragnarok'?,Tom Hiddleston
Who acted as Mike Norton in the movie 'The Three Burials of Melquiades Estrada'?,Barry Pepper
Who acted as Pat Kramer in the movie 'The Incredible Shrinking Woman'?,Lily Tomlin
Who acted as Olivia Wenscombe in the movie 'The Prestige'?,Scarlett Johansson
Who acted as June Carver in the movie 'Two Weeks Notice'?,Alicia Witt
Who acted as Oscar in the movie 'Bitter Moon'?,Peter Coyote
Who acted as Asuka Langley Shikinami in the movie 'Evangelion: 3.0 You Can (Not) Redo'?,Yuko Miyamura
Who acted as Derek in the movie 'Back to School'?,Robert Downey Jr.
Who acted as Rachel Singer in the movie 'The Debt'?,Helen Mirren
Who acted as Hassan in the movie 'Four Lions'?,Arsher Ali
Who acted as Grace in the movie 'Queens Logic'?,Jamie Lee Curtis
Who acted as Shinji Ikari in the movie 'Evangelion: 3.0 You Can (Not) Redo'?,Megumi Ogata
Who acted as Bernard in the movie 'Land and Freedom'?,Frédéric Pierrot
Who acted as Lindsey in the movie 'Hideaway'?,Christine Lahti
Who acted as Dan Cain in the movie 'Re-Animator'?,Bruce Abbott
Who acted as Bad Blake in the movie 'Crazy Heart'?,Jeff Bridges
Who acted as Shagal in the movie 'The Fearless Vampire Killers'?,Alfie Bass
Who acted as Dawnie Melville in the movie 'Tim'?,Deborah Kennedy
Who acted as Henry Chinaski in the movie 'Barfly'?,Mickey Rourke
Who acted as Alan in the movie 'Forces of Nature'?,Steve Zahn
Who acted as Ronald in the movie 'Creepshow 3'?,Justin Smith
Who acted as Jules in the movie 'Demonic'?,Megan Park
Who acted as Hesper Navigator in the movie 'After Earth'?,Chris Geere
Who acted as Sgt. Tony Meserve in the movie 'Casualties of War'?,Sean Penn
Who acted as Kent Arlington in the movie 'While We're Young'?,Brady Corbet
Who acted as Alison Gordon in the movie 'Saw'?,Monica Potter
Who acted as Sheriff Steiner in the movie 'Camille'?,Ed Lauter
Who acted as Charlie Gargas in the movie 'Nothing in Common'?,Héctor Elizondo
Who acted as Peter Alison in the movie 'The Black Cat'?,David Manners
Who acted as Mika in the movie 'The Captive'?,Kevin Durand
Who acted as Kay Amin in the movie 'The Last King of Scotland'?,Kerry Washington
Who acted as Harry Noble in the movie 'Batteries not Included'?,Frank McRae
Who acted as Carl Smith in the movie 'The Graduate'?,Brian Avery
Who acted as Gladys Hallward in the movie 'The Picture of Dorian Gray'?,Donna Reed
Who acted as Samir Horn in the movie 'Traitor'?,Don Cheadle
Who acted as Stuart in the movie 'The Disappearance of Eleanor Rigby: Them'?,Bill Hader
Who acted as Guy in the movie 'The Science of Sleep'?,Alain Chabat
Who acted as Louise in the movie 'Sister'?,Léa Seydoux
Who acted as Jill Goddard in the movie 'Open Windows'?,Sasha Grey
Who acted as Nicky in the movie 'Christmas at Cartwright's'?,Alicia Witt
Who acted as Eddie in the movie 'Barbershop'?,Cedric the Entertainer
Who acted as Niels in the movie 'In a Better World'?,Martin Buch
Who acted as Dwayne McLaren in the movie 'Cut Bank'?,Liam Hemsworth
Who acted as Harry Potter Jr. in the movie 'Troll'?,Noah Hathaway
Who acted as William Dobbin in the movie 'Vanity Fair'?,Rhys Ifans
Who acted as Jeb Scott in the movie 'Shattered'?,Corbin Bernsen
Who acted as Kevin Fischer in the movie 'Final Destination 3'?,Ryan Merriman
Who acted as Mark Shermin in the movie 'Starman'?,Charles Martin Smith
Who acted as Lewis Skolnick in the movie 'Revenge of the Nerds II: Nerds in Paradise'?,Robert Carradine
Who acted as Steve Wozniak in the movie 'Steve Jobs'?,Seth Rogen
Who acted as Claus Schenk Graf von Stauffenberg in the movie 'Valkyrie'?,Tom Cruise
Who acted as Special Agent Ernest Paxton in the movie 'The Rock'?,William Forsythe
Who acted as Mushu in the movie 'Mulan II'?,Mark Moseley
Who acted as Kate in the movie 'Carriers'?,Emily VanCamp
Who acted as Giulietta in the movie 'Terraferma'?,Donatella Finocchiaro
Who acted as Maj. Sophie E. Jean in the movie 'Joint Security Area'?,Lee Young-ae
"Who acted as Marcy Dargon in the movie 'Stockholm, Pennsylvania'?",Cynthia Nixon
Who acted as Alex Wright in the movie 'Grave Encounters 2'?,Richard Harmon
Who acted as Thomas Crown in the movie 'The Thomas Crown Affair'?,Steve McQueen
Who acted as Glen Stevenson in the movie 'Little Monsters'?,Daniel Stern
"Who acted as Yoon Tae-goo, the Weird in the movie 'The Good, The Bad, The Weird'?",Song Kang-ho
Who acted as Charles Remington in the movie 'The Ghost and the Darkness'?,Michael Douglas
Who acted as Mike Fletcher in the movie 'The Factory'?,John Cusack
Who acted as Patrice Jacinto in the movie 'Jade'?,Angie Everhart
Who acted as Lizzie Bradbury in the movie 'Wimbledon'?,Kirsten Dunst
Who acted as Sakaki Hyobu in the movie 'Ninja Scroll'?,Shûichirô Moriyama
Who acted as Melina in the movie 'Total Recall'?,Jessica Biel
Who acted as Melanie Thorne in the movie 'Hellraiser: Inferno'?,Noelle Evans
Who acted as Aunt Judy Kling in the movie 'Zenon: Girl of the 21st Century'?,Holly Fulger
Who acted as Peter the Great in the movie 'Russian Ark'?,Maksim Sergeyev
Who acted as Carole in the movie 'Café de Flore'?,Hélène Florent
Who acted as Billie Holiday in the movie 'Lady Sings the Blues'?,Diana Ross
Who acted as Mitch in the movie 'Leprechaun 3'?,Michael Callan
Who acted as Louise Keeley in the movie 'The Birdcage'?,Dianne Wiest
Who acted as Deputy Anders in the movie 'We Are What We Are'?,Wyatt Russell
Who acted as Melina in the movie 'Total Recall'?,Rachel Ticotin
Who acted as Vegeta in the movie 'Dragon Ball Z: Broly - The Legendary Super Saiyan'?,Ryou Horikawa
Who acted as Francesca Vanini in the movie 'Contempt'?,Giorgia Moll
Who acted as Herself in the movie 'Capitalism: A Love Story'?,Marcy Kaptur
Who acted as Priest in the movie 'Priest'?,Paul Bettany
Who acted as Squire Gordon in the movie 'Black Beauty'?,Peter Davison
Who acted as George Tunner in the movie 'The Sheltering Sky'?,Campbell Scott
Who acted as Michel in the movie 'Love in the Afternoon'?,Van Doude
Who acted as Mr. Tyree in the movie 'Dear John'?,Richard Jenkins
Who acted as Josh in the movie 'Hostel'?,Derek Richardson
Who acted as Matt Gavin in the movie 'Jade'?,Chazz Palminteri
Who acted as Principal Kirkpatrick in the movie 'Assassination of a High School President'?,Bruce Willis
Who acted as Dr. Doom / Victor Von Doom in the movie 'The Fantastic Four'?,Joseph Culp
Who acted as David Lord in the movie 'Arena'?,Kellan Lutz
Who acted as Jack Stanton in the movie 'Primary Colors'?,John Travolta
Who acted as Father Durning in the movie 'Stigmata'?,Thomas Kopache
Who acted as Smithers in the movie 'Stormbreaker'?,Stephen Fry
Who acted as Leila in the movie 'Fear City'?,Rae Dawn Chong
Who acted as Gaines in the movie 'Rush'?,Gregg Allman
Who acted as Isaac in the movie 'About Alex'?,Max Minghella
Who acted as Altamirano in the movie 'The Mission'?,Ray McAnally
Who acted as Sherry Pierce in the movie 'Big Momma's House'?,Nia Long
Who acted as Daniel Morales in the movie 'Taxi'?,Samy Naceri
Who acted as Little Girl in the movie 'Silent House'?,Haley Murphy
Who acted as Mary Rice in the movie 'Jumper'?,Diane Lane
Who acted as Hamilton Bartholemew in the movie 'Charade'?,Walter Matthau
"Who acted as Security Officer Tomo Iwanaga in the movie 'Godzilla, King of the Monsters!'?",Frank Iwanaga
Who acted as Dr. Mengers in the movie 'Piranha'?,Barbara Steele
Who acted as Ludo Dekker in the movie 'Rabbit Without Ears 2'?,Til Schweiger
Who acted as Lee Hing in the movie 'The Protector'?,Peter Yang Kwan
Who acted as Richard Strout in the movie 'In the Bedroom'?,William Mapother
Who acted as Sergeant Howie in the movie 'The Wicker Man'?,Edward Woodward
Who acted as Charles Lewin in the movie 'Losing Isaiah'?,David Strathairn
Who acted as Simon Sheppard in the movie 'Dracula 2000'?,Jonny Lee Miller
Who acted as Kate Bradley in the movie 'Hellraiser: Revelations'?,Sanny van Heteren
Who acted as Francesca Danelli in the movie 'Bride of Re-Animator'?,Fabiana Udenio
Who acted as Williams in the movie 'Frantic'?,John Mahoney
Who acted as Barney in the movie 'The Neverending Story II: The Next Chapter'?,John Wesley Shipp
Who acted as Coach Jack Reilly in the movie 'The Mighty Ducks'?,Lane Smith
Who acted as Burt Gummer in the movie 'Tremors 3: Back to Perfection'?,Michael Gross
Who acted as Gwen Heigh in the movie 'Texas Killing Fields'?,Annabeth Gish
Who acted as Henry in the movie 'Enemies Closer'?,Tom Everett Scott
Who acted as Luna in the movie 'Scooby-Doo! and the Witch's Ghost'?,Kimberly Brooks
Who acted as Ian in the movie 'Alvin and the Chipmunks: The Squeakquel'?,David Cross
Who acted as Avery Miller in the movie 'Trespass'?,Liana Liberato
Who acted as Moose in the movie 'Step Up 2: The Streets'?,Adam G. Sevani
Who acted as Detective David Tapp in the movie 'Saw'?,Danny Glover
Who acted as Paul in the movie 'Honeymoon'?,Harry Treadaway
Who acted as Diane Shaver in the movie 'The Vanishing'?,Sandra Bullock
Who acted as Malcolm in the movie 'The Interview'?,Timothy Simons
Who acted as Harry Dalton in the movie 'Dante's Peak'?,Pierce Brosnan
Who acted as Sugar Ray in the movie 'Harlem Nights'?,Richard Pryor
Who acted as Gerald in the movie '2012: Ice Age'?,Gerald Webb
Who acted as Jacob Singer in the movie 'Jacob's Ladder'?,Tim Robbins
Who acted as Morgan Weld in the movie 'Wind'?,Cliff Robertson
Who acted as Ty Moncrief in the movie 'Drop Zone'?,Gary Busey
Who acted as Fran in the movie 'Man Up'?,Harriet Walter
Who acted as Juliana Kelly in the movie 'The Brood'?,Nuala Fitzgerald
Who acted as James in the movie 'October Gale'?,Callum Keith Rennie
Who acted as Duke in the movie 'She's the Man'?,Channing Tatum
Who acted as Alex in the movie 'Panic'?,William H. Macy
Who acted as Scrooge McDuck in the movie 'Mickey's Christmas Carol'?,Alan Young
Who acted as Sean Jackson in the movie 'Valentine's Day'?,Eric Dane
Who acted as Dick Bell in the movie 'What Just Happened'?,John Turturro
Who acted as Young Sean in the movie 'Birth'?,Cameron Bright
Who acted as Marcus Wright in the movie 'Terminator Salvation'?,Sam Worthington
Who acted as Victor Richardson in the movie 'Testament of Youth'?,Colin Morgan
Who acted as Wendy Anne Potter in the movie 'Troll'?,Jenny Beck
Who acted as Reldresal in the movie 'The 3 Worlds of Gulliver'?,Lee Patterson
Who acted as Carswell in the movie 'The Ipcress File'?,Gordon Jackson
Who acted as Leigh Cabot in the movie 'Christine'?,Alexandra Paul
Who acted as Tommy Uva in the movie 'Rob the Mob'?,Michael Pitt
Who acted as James Bond in the movie 'Live and Let Die'?,Roger Moore
Who acted as Sybil Thorndike in the movie 'My Week with Marilyn'?,Judi Dench
Who acted as Rebecca Porter in the movie 'In Your Eyes'?,Zoe Kazan
Who acted as Neil Perry in the movie 'Dead Poets Society'?,Robert Sean Leonard
Who acted as John Cutter in the movie 'Passenger 57'?,Wesley Snipes
Who acted as Andrew Detmer in the movie 'Chronicle'?,Dane DeHaan
Who acted as Alex Holland in the movie 'The Puppet Masters'?,Keith David
Who acted as Pirelli in the movie 'Sweeney Todd: The Demon Barber of Fleet Street'?,Sacha Baron Cohen
Who acted as Yvette in the movie 'Indochine'?,Dominique Blanc
